content_id,content,subject,sentiment_value,sentiment_word
vUXizsqexyZVRdFH,因为森林人即将换代，这套系统没必要装在一款即将换代的车型上，因为肯定会影响价格。,价格,0,影响
4QroPd9hNfnCHVt7,四驱价格貌似挺高的，高的可以看齐XC60了，看实车前脸有点违和感。不过大众的车应该不会差。,价格,-1,高
QmqJ2AvM5GplaRyz,斯柯达要说质量，似乎比大众要好一点，价格也低一些，用料完全一样。我听说过野帝，但没听说过你说这车。   ,价格,1,低
KMT1gFJiU4NWrVDn,这玩意都是给有钱任性又不懂车的土豪用的，这价格换一次我妹夫EP020可以换三锅了,价格,-1,有钱任性
nVIlGd5yMmc37t1o,17价格忒高，估计也就是14-15左右。   ,价格,-1,高
TVciHBPL5XmUxMEd,我开始就是荣放2.5  森林人2.5二选一    荣放主要是底盘质感不行   太硬  其次是不能打开的天窗  和公主坟   不过价格确实便宜    少了5W块,价格,1,便宜
4lb9TsO5rjqUy1Bu,唉，这货的价格死硬死硬的，低配版优惠1万据说已经罕有了。    ,价格,-1,死硬
z98xV7MphZIF4EvO,价格的话只能说一般般吧，太仓前段时间定的比你便宜！    ,价格,0,一般
hoWrMnGTUvdsK3Dm,听过，价格太贵，但一直念念不忘    ,价格,-1,贵
r1WHgbI0ZKqMdELy,恭喜恭喜，这个优惠不错哦！,价格,1,优惠不错
JSQUo6kblXYvtc2h,优惠幅度不小了，北京优惠八千,价格,1,优惠幅度不小
7kCF590PjAYqzEL6,优惠可以了！购进吧！买了不会后悔的！时间可鉴！   ,价格,1,不会后悔
EXBiRczhIu3paJWb,现在 什么价 优惠多少,价格,0,优惠
nQ0bIZtzj6P1Esgd,优惠一万一 送贴膜装甲脚垫 铁西庞大,价格,0,优惠
JvXIqLT8cGDuPEWe,我也大连的，最近也考虑入手森林人，优惠太小了,价格,-1,优惠太小
NXyGEbt0AZ5rHJ3e,山东威海全系这才优惠3000，MD,价格,-1,才优惠
kN0LghcimajxWwH8,下手了，豪导特供，优惠1.6万,价格,0,优惠
vVoKucJy5pO0jSk2,优惠了8000，什么都不送。    ,价格,0,优惠
iBFJMqHtTRD5Qo6S,兄弟2.5豪导特供优惠1.6万可以下手吗？    ,价格,0,优惠
G8Yr51elsVaXFUZC,恭喜，优惠多少，我准备明天去提，2.5特装优惠两万,价格,0,优惠
10WF8Q53pVfOryvA,什么车款，多少优惠啊？康桥我只能谈到优惠1.5其他还送什么没问，试驾了一次看了两次2.0时尚     ,价格,0,优惠
VrRd1HcoMNAkvhJy,优惠1 ，就送行程记录     ,价格,0,优惠
1BYpO9FsgkmWLNQu,平常心吧，我本来想买傲虎，优惠不大，钱不够，改提森林人，6月提尊贵优惠1.4w，到了9月做活动森林人全系2w，傲虎全系3w，我......   ,价格,0,优惠
9EFImNb0ywhHBlcR,哈哈，25.48。优惠够给力    ,价格,0,优惠
2aNFSuYeZo7B1b9R,兄弟，我也云南的，你的优惠也挺大的，现在哪里来的全系3万啊。。。现傲虎全系无优惠，森林人才八千    ,价格,-1,才
4EK1Nu7X2DTzomRS,来湖北，我上月订的2.0蓝色时尚，优惠1万3送6次保养，本月底提车,价格,0,优惠
TWPEyNaI5mFgYupn,什么都没有，就是现金优惠和给了点小东西    ,价格,0,优惠
96A5VQfBgPWUYkul,什么都没有，就是现金优惠和给了点小东西，你最好先问问看有没有车    ,价格,0,优惠
JXlEzBcKGpI8stdr,原来最低也就优惠15000至16000   ,价格,0,优惠
P5A3evWb9jUyHMB2,我们这里，优惠2000，我呵呵了,价格,-1,呵呵
RJe23jzrhZS4YDf7,遵义优惠6000，送十万公里包养,价格,0,优惠
zYfd7eDQqKZglLRi,深圳这破地方居然只优惠5K，看大家说的竟然有1万5的,价格,-1,只优惠
LOCJwcQRnB9D1UWX,我只看到优惠20K ，不错。呵呵,价格,0,优惠
SqulQGhIwreFVHYb,本来谈到2.5豪华优惠1万，因为想要10月份以后的车，销售推荐了特装。比尊贵只差了轮毂，很值    ,价格,1,值
ACrPWTUvI2BOZHN5,优惠1万，上5年保险延保两年，不交钱    ,价格,0,优惠
YVfZamz38QbrtMGx,哦，套路。。。。送的礼包也只有保养实惠点，现金优惠搞到最大，再弄几次保养。,价格,-1,套路
MsCmRYyhIen2GBjZ,特装确实不错，配置很实用,配置,1,实用
bhpH5MCV0GorXLud,没cd，没后视镜记忆。之家配置单里写有的,配置,-1,没
KOD82cJZ6CvI0e4R,长城配置好！性价比高！,配置,1,好
KOD82cJZ6CvI0e4R,长城配置好！性价比高！,价格,1,高
lkRcwBU9zQbdHeoj,特装我觉得就是多了几个不实用的配置，除了电动尾门，其他都没意义,配置,-1,不实用
1WpNIYyxzfmnUlrH,摩雷的听爱卓和优特声听人声都非常OK，而且价格不算高。DLS的低频应该是不用担心的，建议后门装，不加低音的前提下！可以加好友聊配置方案！    ,配置,1,OK
tlj956MLseiyCTND,这个山寨导航屏幕很背光 换任何导航软件 我都提不起兴趣,配置,-1,背光
q8wYIbkWPTmcv7da,原车的卡打开  显示所有文件 拷贝所有文件除了ini文件.   拷贝到16G卡(先格式化，我用的32G) 论坛下载的凯立德 拷贝整个文件以及ini文件到16G卡， 把ini设为只读. 插入导航开机，齐活了， 不复杂吧!,配置,0,
GI4jT7Rvn9JECKVP,个人感觉 改导航 没什么用 还不如手机，2.0改那个中控小彩屏真心不错。,配置,1,不错
A6NsxYld5Ww9nqZh,还是没有手机导航更新快  而且还有实时路况,配置,-1,没有
sz5SD8QwktNdIEJx,不仅16款，斯巴鲁的导航全是到港装的国产山寨导航，分辨率正常啊,配置,-1,山寨
9nVacW5jLDCH267x,别卖了兄弟，森林人好开不保值。买的时候尊贵值钱，卖的时候尊贵不值钱，导航也不值钱，较少的公里数和良好的车况基本无视。发票价第一年八折，往后每年一折，四年的车就还剩5-6折····,配置,-1,不值钱
gyRioxAM0UEkjDus,XT性价比不高，太贵啦！还是买2.5豪华导航版吧（2.5低配）。    ,配置,-1,贵
rf7K8CHOj6dVJmEI,个人意见现车导航比不上手机好用，音响改装就是花无用钱。,配置,-1,比不上
8qIz60Ch5WbaVmc1,我16款开导航一会儿屏幕就黑了,配置,-1,黑
aA6qlSkoHIrts85y,2015款特装的导航谁升级了？,配置,0,
n2pkF0Y6y4VjcBRd,原车CD音质好的很，我把4S送的导航拆了又换回CD机头了。纯粹，简单，实用！这也是斯巴鲁的精神！车么，是用来开的，不是用来玩APP的,配置,1,好
hL8JZfmrwHMDzUsE,垃圾导航 都不晓得怎么退出  比如听收音，退到主界面还是收音在响，换成USB就能切换过来，到了USB又不知道怎么退出. 先天不足啊,配置,-1,垃圾
QPWzrFTepBUuGlx8,我的导航从没有死机过。,配置,0,
hUAmRWNtwXyc2BSE,显示屏幕应该不支持蓝光的，原装的导航太差,配置,-1,差
zsueijMfUkJVCEXt,说实话，基本上用不上车上导航，用手机更方便！音响效果不用纠结，毕竟不是想成为移动音乐厅。,配置,0,
Abigh0pODZ6UyMVa,买车不到半年，导航经常卡死，现在连蓝牙都连不上,配置,-1,卡死
SuU1GmxPA03sRt47,那个貌似是设置载重胎压用的，也就是载几个人或者是拖拖车的胎压用的，原车有带内置胎压计无奈不显示数值也无适配的独立的显示屏，我加了一个外置的固特异的胎压计（之前老车上拆下的），可以显示数值总感觉安心一点。,配置,0,
IF2Abxuj1yzmV7Eq,上下推动，切换中控显示屏，设置显示屏的,配置,0,
nCH1RTSBGXU0E3a4,需要DIY：把‘输入接口’焊接到汽车音响线路板的音量电位器的中线接点处和接‘地’点即完成。器材：输入接口一只、屏蔽跳线（普通跳线也可以）；工具：电烙铁、焊锡；,配置,0,
6ZvDHFNPk9lMSpK2,已经无法重启了，黑屏了一星期    ,配置,-1,黑屏
Vb7usnJkHafBIWFG,显示屏的分辨率惨不忍睹    ,配置,-1,惨不忍睹
ZF2XPLNYs41Rhozl,2.5有小彩屏中控，这个值,配置,1,值
aNJpOgnXy4o5TVhe,长按电源键可关收音机，短摁关屏幕显示。    ,配置,0,
QZvRJzxCAUIswBrW,兄弟，我也是13款森林人，想换4.3彩屏的CD，请问所有按键都可以用吗？USB支持什么格式的音乐？无损支持吗？    ,配置,0,
QvJn3XNr0FSjzZ5s,这玩意我从来没看过，真鸡肋，有倒车影像这个基本没用,配置,-1,鸡肋
OkMGCaSE1xD4rujm,我觉得360全景没必要。在外面改的效果也一般。装两个前雷达就可以了。,配置,0,
XgO0ixdBwTn6IsF4,昨天看了傲虎ES的官方视频，发现比一般的雷达ACC牛逼很多。。如果能加就好了！！,配置,0,
DIlCAMSxFYaWGP3z,年前优惠了12000 送了一套前置雷达,价格,0,优惠
V6FHl7vEXCOBcUGa,石桥这款轮胎是进口的，我记得途虎网上面有，但是有可能要提前预定的。我觉得森林人这款车有条件可以配二套轮胎，日常使用就用石桥的原配胎，走长途自驾马牌ccc系列不错。,配置,0,
FsAOim03dS2rBV9G,轮胎型号太多，挑选真是个折磨人的事。,操控,0,
k8oZIm9PRGrtsSv2,抗磨性能呢？我现在的胎磨损的那个还没到，主要是老化的厉害，寻思以后轮胎好好养护的，在轮胎不老化的前提下，尽量抗磨点   ,操控,0,
IeXnv29Rf3Bm6WKS,换4条静音轮胎才是正道,舒适性,0,静音
kPLH5G6jy2Rin1ZE,轮胎调平衡纯属扯蛋。轮胎如有动平衡问题，不换位也要调平衡。如果不存在，怎么换位都无所谓，除非有啃胎现象。,操控,0,平衡
hj6R3giB1q9T0t8Y,有的时候公里数多了平衡块会跑掉的，不过一万做动平衡确实早了。我4万换位做的动平衡有一个轮胎少了。   ,操控,0,平衡
znvfsaNSU6pb43hW,中控显示怎么连线的？谢谢,配置,0,连线
45uS1g98pkiWRL32,主要难点在于拆中控和方向盘，其它没什么。另外准备几根带针脚的线。游丝用胶布固定一下就好。其它很简单。   ,配置,0,简单
rvMT4zSUmHaXEpWn,哈哈，也是好车，不太喜欢它中控   ,配置,1,不太喜欢
tKU0QLuF34pyxn8V,人家奥迪、JEEP都曾经用过CVT，都换掉了，追求走量、节油的才选，早晚号称全是四驱的森林人要把靠摩擦而不是啮合的减速箱抛弃   ,油耗,0,
9xSUq3Ovc4eGTZVy,追求省油的驾驶习惯，一定会加重积炭的产生，从而导致爆震，建议定期使用积炭添加剂！,油耗,0,
lQNsJe87jMUC2AvV,我看LZ是11.6油耗，还行啊。跑几次高速就下来了。放心吧,油耗,1,还行
I5VAaUHWlS60mvQL,不会2.0比2.5还费油吧？！我的2.5平均油耗9.6，开了3000多公里，基本是市里跑，北京那么堵车这油耗就很满意了。,油耗,1,满意
QhW8lfB4FPYgw7kZ,10年的车 2.5排量的  目前86000KM    市区  10--12个    高速8-9个  油   出保后  一直外面保养 价格 300--500  间,油耗,0,
nTGAzi61eUoBlgFb,上下班为主，平均油耗10个点多一点，保养时5000公里保养一次，价格还行,油耗,0,
3A26BUlaZJeFKNyj,我的16款，跑了5000公里不到，油耗7.8 。满箱油全跑高速800公里没问题，我刚换了后视镜，配件一个礼拜就到了。唯一不满意的就是高速风噪有点大，别的没毛病。宝鸡车主留。,油耗,0,
e6j37BTDEhsOu1Qr,综合油耗9，除第一次除都是自己买耗材在修理厂换，小保养400元左右。,油耗,0,
ho0UXsP8FB5jeDcq,如果是市区拥堵的话这个油不高  我最高时候13.4冬天   我现在34000了  油耗基本上在10个左右  不用纠结了  每辆车的用车情况都是不一样的,油耗,0,
St0ly3u25ohRkBLe,一直92，偶尔出去了不了解当地油品加95(97)。5万公里从没遇到问题，省油，动力也充足，加95也没感觉有啥不同。,油耗,1,省油
St0ly3u25ohRkBLe,一直92，偶尔出去了不了解当地油品加95(97)。5万公里从没遇到问题，省油，动力也充足，加95也没感觉有啥不同。,动力,1,充足
2Y3MF0av8mbLd5JW,我是2.0 16款，目前5000公里，油耗9个！ 哎哎 后悔没上2.5！   ,油耗,0,
HIWjuAReXt83rTCf,我的小森虽然是2.0的，感觉油门很灵敏，起步时稍微点一下油门就窜出去了,动力,1,灵敏
Y24aOoGZRbJ80E73,cvt反应慢半拍造成的，不是油门原因起步踩油，cvt改变传动比，延迟四驱起步会优先把动力传给后轮，经过传动轴，又一个延迟。给人的反应是踩油不走，条件反射没踩够，再踩等车动了油门给多了。所有你就会感觉窜了。没办法物理瓶颈，4s改不了吧。你可以试试踩油不动。等车动了，再踩。悠着点开,动力,-1,反应慢
g76B9i2PSeKq5uy3,主要是车轻，森林人行驶证上的车重只有1.4t多一点，加上cvt传动，肯定比同级别省油。,油耗,1,省油
EHjWKRp7ZwIJToyO,4AT的一点也不省油！我2011款2.5XS纯市区百公里油耗要13.6L，高速上110KM/H的速度匀速跑的百公里油耗也要8.5L。   ,油耗,-1,不省油
GQ7LvDwEXhn9zafb,我的2014自豪2.0行驶13000公里平均油耗10.6，多数是在市区行驶。为啥其它车主说7至8个，有一个经济时速问题，通常讲再高的驾驶技术和习惯，市区或者市郊行驶，最低也得10个左右，这样才实事求是。   ,油耗,0,
9k7LOMQxrosJqb3z,同款，8200公里，平均时速38，油表显示8.8升/100千米,油耗,0,
bjTDnVRMBQtCrUp0,收费一瓶198一瓶148。 不过市区跑真心积碳严重，排气管黑黑的。 油耗13.8。    ,油耗,0,
FIsT4EtO7pivSHPA,怪不得我的油耗13.6。。。95油，9毛6一公里，全市区。,油耗,0,
NCaIXYrAkb8xQPl2,我的油耗10升左右，加98号的,油耗,0,
SZAHDya1x47fjgor,我这里也是93改92，97改95，不过油耗没这么明显的变化，反正是感觉不出。,油耗,0,
jzHL9n375gpNdE1Y,我油耗13以内就很满意了,油耗,1,满意
EmRcpASKbULBues3,娘胎带的唯一缺点就是油耗比现款略高。    ,油耗,-1,略高
g3yTW8RlDSUP6vCQ,你算少了的了，16款2.0，油耗13.6，全市区，跑了2003公里,油耗,0,
aOlyCibLouVx4RvU,油性液体在收到重力会出现什么情况呢？   ,油耗,0,
lVwiDndz37WA4BfQ,我经常跑济南，我都走青兰高速，车少还是三车道，青岛到诸城限速120，诸城到济南限速100，好跑，省油。,油耗,1,省油
WrBJT9eSgPUucE1f,比如挂d挡不加油走，走了一小节就会熄火，或挂d挡要起步，加一下油马上把油门丢了会熄火。    ,动力,-1,熄火
XoexjlK2gSwHO48r,11款，10.6万了，市内平均 11个油左右，高速 9.5左右，4AT的基本就这样了。,油耗,0,
WP7ISrXOepEdqsZ1,个人感觉开高速不一定省油，即使不堵车，也得看去哪，过年时，由北京向山西陕西方向一路上坡，油耗也得9-10个，返回一路下坡可以7-8个甚至更低，2.5的,油耗,0,
YIHtycdSqAUD05uB,上下坡肯定会有影响的，但总体来说油耗挺满意的    ,油耗,1,满意
0V9oN2whKtF4O5qJ,2.0 平均油耗10个 不到四千公里,油耗,0,
9idZlGnrqwH42KuC,楼主开车真省油！我的2.5尊，去年6月20日提车，目前2.1万公里，综合油耗7.5，已经很知足。,油耗,1,知足
hPoOdaTDlSnLBfWI,我2.5车子，济南到青岛高速全路段限速80公里，我定速巡航，显示油耗5.8！！,油耗,0,
4lpMbJuHCmeIXPVk,当然是很高的水平了！我大部分高速，现在2.2W油耗还得7.0多呢！,油耗,-1,还得
djk0mphFKY6f59JV,xt，8.6 我感觉显示的不准，实际油耗会更高,油耗,0,
fjKyqd0npSGmZPeU,我是16款2.5的，东北冬天温度低，原加92乙醇汽油感觉肉，后改加95纯汽油，感觉有力了。原来平均耗油8.2升，进入冬天，现在综合耗油8.5升。,油耗,0,
MJyinzIlZDWLT14R,我今天油耗跑成9.8了，你又降了吗？   ,油耗,0,
OIWJYXeHaumo347E,开了三百多公里，大概13.5油。说起B格，我开森林人的时候，总是觉得比CRV，途观高那么一点，呵呵    ,油耗,0,
1mCU6W4bpnHdqeIG,13款2.5，，11个油飘过，8个油也就安安静静跑长途时候，现在高速基本9.6个油。。大油门13个油基本～～ 这车大油门，油耗挺大，温柔开油耗确实不高～～,油耗,1,不高
FjXpx7Emi5Q4WUoA,提车3天，开了400多公里。油耗惊人的低啊。。。,油耗,1,低
IHC1TMq2JQjYEOex,初看以为是中国有柴油版手动森林人呢。吓我一跳，原来是外国，油耗确实很低，怎么做到的？路况很好吗？还是基本都是长途？我的纯市区和两公里内短途。油耗9点4。,油耗,0,
WZYXyAc03nGjCTIU,我的09款手动，最低油耗在6升油。国道60时速最省油，你的5点2，难道说柴油比汽油省油的缘故，好羡慕你能生活在荷兰这样的发达国家。很有优越感吧？是留学还是定居？    ,油耗,0,
bCfnu0MYJyshZDGI,楼主，我的09款手动，最低油耗在6升油。国道60时速最省油，你的5点2，难道说柴油比汽油省油的缘故，好羡慕你能生活在荷兰这样的发达国家。很有优越感吧？是留学还是定居？    ,油耗,0,
3FpZILeG6cQBfjtT,2.5豪    原加93   现加95 没感觉有啥特别的差别 就是油耗高了。仅供参考。,油耗,0,没感觉
NQg1SB057xYsmpXv,一样的，高速上120 140 160满载的情况油耗上9个很正常，我的跑了3000多高速好不容易才降到8.6，以前一直在8.2---8.4之间。,油耗,0,
vdPqwZmS0JQ3xhFB,我6挡手动，感觉80最省油    ,油耗,0,
vGoJPk4rwCBm2SAQ,市区平均20多点，油耗11.5,油耗,0,
Q0sNvIqyX3947hx8,2.0老森高速最省油的时速100-110，7.6左右，120就要8.3,油耗,0,
zj3KESwUepGMoiIk,手动6档80迈。省油罡刚的。,油耗,0,
GWFzZ7NtbpMTSc1l,是80，其实60的油耗和80差不多，只不过80是又快又省的最高速度了。,油耗,0,差不多
3dQcPltkrXj4YvVW,过段时间会黄一些 珍珠白油漆很难做 业界难题 除非整车,动力,-1,肉
L8G5euqvwiYQSgVy,我是山东人，现在油耗降到9.6了，以前加的都是98号，现在开始加95号汽油了。98号汽油更换成95号，没发现明显差别。,油耗,0,
qplI274Y6Z5sT0gA,垃圾石墨烯。楼主不信试试就知道了。噪音大。提速慢。轻微烧机油。油耗高。亲自体验结论。现在脱保换的其他机油。,油耗,-1,高
k4eHIUdq7PLQl8DW,啥车都有各种毛病。14年底入了蒙迪欧，市区油耗高的一逼，发动机哒哒哒烦死了。前两天买了个电动，说明书说的最大续航220公里，充了一次电跑了三十多公里电量还有68％可能是我开的比较快。                ,油耗,-1,高
8mJ4znTMhs6Icw3R,福特的发动机耐用，就是油耗高，我一朋友的蒙迪欧在根本不堵的路况下一公里一元，另外福特的纯电动车还是算了吧，纯电动车没有靠谱的，还是丰田的混动车省心，不如买辆二手的雷克萨斯ct200，价格便宜不少，油耗低，质量好，买一辆三年车龄的，还有三年质保，人家6年质保，外加电池8年20万公里质保，丰田的混动车口碑誉满全球    ,油耗,-1,高
hiRBxzXvFfKI2y85,用过两款减震机了，CUSCO、RSR，目前觉得还是原厂最舒适。,舒适性,0,原厂
vRAztNshlaSWYOxd,这车就这样，蹦蹦嗒嗒的。估计lz以前开的车舒适性不错才有这样感觉。,舒适性,0,
eLmSiqv06pfNr2V4,看你的需求，米胖子应该比较适合你，安静舒适,舒适性,0,
cQVS2zpOjEqKmiGI,咱俩只差一个月我刚跑了15000 去这些地方开着感觉咋样？顺便问你一下你的空调出风口有没有坏？或者听说别人是否有坏的,舒适性,0,空调
g8Uw2noap6TfVKhP,有时候如果熄火前没有关空调制冷压缩机，启动的时候压缩机会自动启动，发出类似阀门开起的那种声音，不晓得是不是你听到的那种,舒适性,0,空调
hpyl7WjQKofXq8dg,不开空调默认是开打外循环的，要打开内循环可以不用开空调，直接按空调控制上的内循环开关就可以了，这时空调显示屏上没有温度等信息，只有一个回绕的小箭头汽车图标。,舒适性,0,空调
g4OUT0dnBGVJ9qX6,冷空调开起来都是后面先凉。    ,舒适性,0,空调
z1KFt2yo0jD4lfOc,空调开一档 二档 声音比出风声都大    ,舒适性,-1,大
K0IJkXLnoN2lqu8F,2.5雨天开空调都感觉动力不佳，油门后段不行。,动力,-1,不佳
HNxJZ0OLEd84rlwv,其实是一部很普通的车，唯一亮点不是合资车，钣金的厚度和强度，内饰的落后，棒棒糖，后出风口之类的配置，吹什么经典，此时来看早已赶不上时代的变化，垄断不降价，售后保养达到和超过BBA的费用，让用户望而生畏。,内饰,-1,普通
BDnNpjZfhkA09V2I,除了内饰差点，贵点，其他还好,内饰,0,还好
lAGJVQu3NUP5FY9M,看我的帖子，拿手一掰就拆开了，很好拆，特么森林人内饰太松垮了,内饰,-1,松垮
SKx9oLEehCB35P8V,没有大事故，就是内饰有些旧！需要回来重新搞！谢谢！    ,内饰,-1,旧
pC6e3mQ9VYKanbSE,斯巴鲁确实是好车，就是内饰上面做工差了些   ,内饰,-1,差
YBQfz0GRclmnFXuq,这车的内饰不改改怎么可能卖得好,内饰,-1,不改改
WZKCyh3kaOXA6qnV,内饰照片上传一下，6速手动，开起来真舒服啊。,动力,1,舒服
6GXPYLv0ibIlStm1,发现傲虎后排座椅的包裹性设计，比森林人好那么一点点,内饰,-1,一点点
dTXcunlKzZbi0I14,建议去4S弄吧，这个是一整块的，从座椅靠背旁边容易裂开的那里一直到后面，自己弄弄不好异响更多。,内饰,0,
98EpFfna2PSyeigo,没有必要，只想要原装电动座椅    ,内饰,0,
1p4rdLHQNRX6s2gk,请问后排座椅靠背的角度可调吗   ,内饰,0,
h0CfHRSu6QPn7rZx,后加的腰部支撑支持座椅记忆吗？    ,内饰,0,
I4qsHPkuogCjyD5A,就是这里，做工不细致。农用车本色。这个地方高速起来就是一个噪音腔，把缝隙贴上马上就没那个声音了    ,内饰,-1,不细致
ArG74M0Vvp3ykfLl,有人追求安全可靠抵达，有人追求比赛刺激，需求不同，我是前者,安全性,0,
QRkdEcyW2mMIx9qC,对了。。如果你要7座的。不如直接GT顶配。。有ACC还是会安全很多。。看测试可以直接刹停车的，对了。。森林人没有7座，这也是加分的。。比如多带2个小朋友之类的,安全性,0,
qtahyRTBAvMFDZpY,防爆胎只是俗称，缺气保用轮胎并不防爆，条件合适一样爆。不过胎侧厚点确实要安全点,安全性,0,
PFIy1Q7u3kN9qWhV,觉得不舒服可以别买森林人呀，反对非法改装，原厂的座椅都是经过厂家反复测试的，安全都保障，这种外面路边店的货，除了骗钱还能怎样？一旦出了车祸，小命都不保！    ,配置,0,
whNpfEbRKjU5M2Fv,没有鹰眼，安全性要打很大的折扣,安全性,-1,
I1lbmFQTYCZxNJ5D,全时四驱不仅体现在雨雪恶劣天气下的路况通过表现，同时也是日常驾驶良好的抓地力等主动安全的保证，底盘表现秒杀同价位其他车系品牌说得一点也不为过。真心希望关注喜欢它的人多多去4s店去试驾一番，它的确名符其实。    ,安全性,0,
KfDzTRF8B9PrIeCO,江浙沪一带与广东一带有很多千万级身价的老板都买斯巴鲁森林人或傲虎玩。他们平时商务用桥车，休闲与户外时都用斯巴鲁，低调、安全又耐用。    ,安全性,1,耐用
K3FJRZVdz52OrwmI,我经常上三千转 高速除了紧急情况很少上两千五，市区没办法，想保持安全距离就老要被加塞，只有开的冲点 这个6.0的油耗是因为那天高速车比较多，时速在80到100之间，所以油耗才那么低，之前120的时速油耗大海在7到8之间吧    ,油耗,0,
kK7A30TWjvUIhGfn,16款的灯都不给力，那估计得上激光大灯了 左低右高处于安全行车考虑的,安全性,0,
l5LkJnA8HUPtOBFi,车子是自己开的，啥车都有小毛病，但安全性最重要，可以自己百度一下“3.15调查 某特断轴致两死”,安全性,0,
GKYWa2qf6IBRzPb3,不过出行还是慢慢开安全第一，现在想起来在过一个隧道的时候，注意力不太集中，前面有个大车在隧道里居然没有尾灯，差点追尾,安全性,0,
lC2v7PtMHm9i6LWr,新手的话建议途观，行车安全辅助多些，不是新手试驾后就有结论了,安全性,0,
imbX25NKYqQn9Cjy,我只能这样说用了7个月，感觉森的操控还是非常棒的比我以前的卡罗拉要好很多，缺点就是很多配置内饰比较挫，刹车嘎吱嘎吱的，很多东西要自己慢慢习惯就是。看你银子多少，银子多就上傲虎吧，银子少就上森。傲虎体面点内饰。   ,安全性,0,
imbX25NKYqQn9Cjy,我只能这样说用了7个月，感觉森的操控还是非常棒的比我以前的卡罗拉要好很多，缺点就是很多配置内饰比较挫，刹车嘎吱嘎吱的，很多东西要自己慢慢习惯就是。看你银子多少，银子多就上傲虎吧，银子少就上森。傲虎体面点内饰。   ,内饰,-1,挫
OHvPNBLl5K7CrGq1,停下车的时候，刹车不要重踩，就不会启动启停，轻轻带着刹车就不会启动启停，反之。,安全性,0,
IjoZ6Pn4pOhUGgSK,哥们儿的12款森林人2.5车9.7万公里了，走南闯北，青藏进川臧出，什么毛病都没，上个星期才换的刹车片，除了雨刮，我就在七万公里换了一次轮胎。,安全性,0,
IMcGDXgKUHeQsaZr,看看刹车油是否需要更换,安全性,0,
tP53vTVshQqfnpNG,刹车软只是脚感。感觉刹不住继续踩啊，我就不信你踩到底轮子不抱死？原厂刹车足够用了，别换，费钱,安全性,-1,软
RoqVnADsiyCbXfIO,1、噪音，可以考虑做个全车隔音，效果很不错。2、刹车软，我也觉得，所以我换了好点的刹车皮，效果杠杠的，至于品牌，很多不错的，我选了dixcel。,安全性,-1,软
