content_id,content,subject,sentiment_value,sentiment_word
f6S2dQuDybwkOqaV,这不是电子限速了。而是动力跟不上，快不了了,动力,-1,跟不上
PFHpezDTGg8ruo1w,你试试通电到发动机过机油。然后关闭在次通电自检完毕然后在启动。应该就好了。机油太稀泵不到发动机个系统。,动力,0,
sXLy2nO1FuWUwJTh,具体要看车况，发动机、变速箱工作状况，车架等等～,动力,0,
3aVETwtxcFrP0WmX,16款2.5高速市区油耗都和你差不多，之前市区油耗也在9到10个左右，但越来越熟悉后，喜欢深踩油门起步，现在市区差不多都12个左右,油耗,0,
vfewHXB3yUp0QDJn,全合成900多保养一次，其实花销大不了多少，但是换配件就厉害了，价格真是杠杠的，跟奔驰差不多。,价格,0,价格差不多
80IypWouXBNjhJQ1,买车后到现在1800公里， 高速路可能有400公里， 油耗9.4   ,油耗,0,
etuSDUcn5iMPopgj,没有一点问题，我们12年4森4虎走的川藏线，动力没问题，全程车也没问题，只是轮胎扎了三条，爆了一条。现在的川藏线好跑多了，更应该没有问题了。   ,动力,1,没问题
J4df9RKot3uFsI5q,借你吉言，不过这辆车打算至少开个十年二十年，老百姓买车不容易，尽量别让自己后悔，至少目前为止特别满意，动力操控都很满意，尤其是操控，动力很跟脚，满意    ,操控,1,操控很满意
J4df9RKot3uFsI5q,借你吉言，不过这辆车打算至少开个十年二十年，老百姓买车不容易，尽量别让自己后悔，至少目前为止特别满意，动力操控都很满意，尤其是操控，动力很跟脚，满意    ,动力,1,满意
aMZeGlEUKf0pNzOB,也出现过，感觉跟我开空调有关，再就是有时候脚累了稍微动了一下,舒适性,-1,音响太差
c97sQX4VwKO0FfzB,见我另外一个帖子，有买车过程，车子开的很爽，方向轻，反应灵敏，加速不错，空调凉。现在不好的方面就是起步比较窜，刹车软，油耗在市区要13个，最受不了的就是音响实在实在太差，下周换了它。还有隔音差，喇叭滴滴声，太次了，感觉就是在车内响一样。,安全性,-1,刹车软
c97sQX4VwKO0FfzB,见我另外一个帖子，有买车过程，车子开的很爽，方向轻，反应灵敏，加速不错，空调凉。现在不好的方面就是起步比较窜，刹车软，油耗在市区要13个，最受不了的就是音响实在实在太差，下周换了它。还有隔音差，喇叭滴滴声，太次了，感觉就是在车内响一样。,舒适性,-1,隔音差
c97sQX4VwKO0FfzB,见我另外一个帖子，有买车过程，车子开的很爽，方向轻，反应灵敏，加速不错，空调凉。现在不好的方面就是起步比较窜，刹车软，油耗在市区要13个，最受不了的就是音响实在实在太差，下周换了它。还有隔音差，喇叭滴滴声，太次了，感觉就是在车内响一样。,动力,1,加速不错
znvsS0hbDICWtmg7,支持楼主，好样的，就是不服输的精神更好地警示那帮奸商。不知道是否有高手能告倒庞x强奸销售垃圾导航,配置,-1,垃圾导航
3cXUeqiQJ1v2Ma5s,还是正常的保养，机油机滤和空调滤芯空气滤芯这几样，没有什么特别的了，不差钱就给发动机做个积碳清洗,动力,0,
3cXUeqiQJ1v2Ma5s,还是正常的保养，机油机滤和空调滤芯空气滤芯这几样，没有什么特别的了，不差钱就给发动机做个积碳清洗,舒适性,0,正常保养
MyO3AXJHRVciFe40,我貌似换上邓禄普的后也油耗增加,油耗,-1,油耗增加
91ks7WpFTH2hJ0IS,不知价格，你问问别人吧    ,价格,0,
E9nMke1UwyGDopZS,机油机滤，之前要是没换过空滤和空调滤芯可以换换，空气好的地方这两样吹吹等2万换也凑合。,舒适性,0,
G09RSquM31ABjKkO,600转是不是方向盘抖动,操控,0,
PAKLc4spyVfmY39F,某宝上有店，正常价格都在800左右吧！我赶上做活动时买的，600左右一条哈    ,价格,0,
VAr9bPsN3ljpgiDF,2.0 上周末来回将近500公里高速平均130km/H 满载全程空调，油耗8.8,油耗,0,
VAr9bPsN3ljpgiDF,2.0 上周末来回将近500公里高速平均130km/H 满载全程空调，油耗8.8,舒适性,0,
fUyqhar1YW5oVtlL,恭喜！ 我是2.5自豪，我不追求起步冠军，开车比较温柔，加速不超过25%，一般在15%左右，因此有耗比较低，在郊区马路35公里路程平均有耗在8.0左右。   关于刹车偏软或刹车初期有空位，最近加了个刹车顶，刹车明显改善，与美系车没区别。下次上个图看一下。,动力,0,
GqsJmlX3B587OkEK,刹车优先就是当你踩下油门，油门保持深度的同时踩刹车，发动机转数掉到怠数状态。凯美瑞油门卡住了，出事了。没有刹车优先，踩刹车也无法制动    ,安全性,0,
FIEDp2zMJKtm6cCd,看你一本正经的胡说八道。单缸柴油机也是水平，没听说过过度的磨偏，宝马本田雅马哈都有水平汽缸的摩托，没听说过度磨偏，怎么斯巴鲁就磨偏？几百克重量，几牛的重力，发动机扭矩动则一二百牛米，能有多大影响？ 水平汽缸润滑不好，直列汽缸完全倒置，受重力影响应该全部润滑不好。水平对置有两层含义，水平和对置。    ,动力,0,
SqfW5FeUtPR6axo8,森的空间大吧，怎么就傲虎空间大了？我只能说，两车差别其实就是现款的价钱，傲虎电子设备多点，我估计森加上电子设备的话价格应该差不多。但外观个人喜欢森。最终也选了森。,外观,0,
SqfW5FeUtPR6axo8,森的空间大吧，怎么就傲虎空间大了？我只能说，两车差别其实就是现款的价钱，傲虎电子设备多点，我估计森加上电子设备的话价格应该差不多。但外观个人喜欢森。最终也选了森。,空间,1,空间大
SqfW5FeUtPR6axo8,森的空间大吧，怎么就傲虎空间大了？我只能说，两车差别其实就是现款的价钱，傲虎电子设备多点，我估计森加上电子设备的话价格应该差不多。但外观个人喜欢森。最终也选了森。,价格,0,差不多
EQp4HYDcNunBIS57,发电机不会像空调压缩机那样间断工作吧，发动机工作，发电机转动就在工作只是怠速电压12v，电压随发动机转速提高电压也升高，但最高也不会超过14.5v的额定工作电压。向不向电瓶充电由电脑调节。,动力,0,
EQp4HYDcNunBIS57,发电机不会像空调压缩机那样间断工作吧，发动机工作，发电机转动就在工作只是怠速电压12v，电压随发动机转速提高电压也升高，但最高也不会超过14.5v的额定工作电压。向不向电瓶充电由电脑调节。,舒适性,0,
CwEpP64exJXsycu2,无论怠速还是高速发电机都被推着发着电的，用电设备越多它的负荷越大，相对于空调压缩机，发电机的耗能简直可以忽略不计。,舒适性,0,忽略不计
IgSHklnJTwqO9Ri8,开过小排量的车的人都知道，开空调开车和不开空调开车动力表现可以差非常远！ 空调说白了就是发电机的电而已，开空调导致发电机需要全力工作，因而可以吃到发动机十几二十匹马力是很正常的事情！ 所以现在有很多车设计成深踩油门，行车电脑会停掉发电机保证车辆的动力输出！ 所以深踩的时候后电压会掉下来，因为发电机停了，原因就这么简单……根本不能算问题……,动力,0,
IgSHklnJTwqO9Ri8,开过小排量的车的人都知道，开空调开车和不开空调开车动力表现可以差非常远！ 空调说白了就是发电机的电而已，开空调导致发电机需要全力工作，因而可以吃到发动机十几二十匹马力是很正常的事情！ 所以现在有很多车设计成深踩油门，行车电脑会停掉发电机保证车辆的动力输出！ 所以深踩的时候后电压会掉下来，因为发电机停了，原因就这么简单……根本不能算问题……,舒适性,0,不算问题
KmedVUFubBZnTj5l,我的是开空调时空档偶尔抖动,舒适性,0,
zlYhDgFjEuKkQxyH,空调随便你怎么吹，屁股和内心都是热的，还凉不下来    ,舒适性,0,
kZuEFwPLRUfs5vc4,这个是没有导航的吧，只有手机蓝牙,配置,0,没有导航
1d3fsmJ9WhUZAIHg,现在还用车载导航，手机百度导航好用刷新快。,配置,0,
L4foClBd1IpqtiVW,贱吧喽嗖的的空调滤和空气滤不知道用着成不。,舒适性,0,
Bt9kSh01zNT7prnC,09年10多万公里车了，噪音大点正常。建议你把底盘胶套、全车油水、四门及窗胶条换一遍，噪音会改善很多。    ,操控,0,
Bt9kSh01zNT7prnC,09年10多万公里车了，噪音大点正常。建议你把底盘胶套、全车油水、四门及窗胶条换一遍，噪音会改善很多。    ,舒适性,0,正常
d3PvXmJIOanwVsyh,09年10多万公里的车至少是上一个款的车型了，噪音大点正常。建议你把底盘胶套、全车油水、四门及窗胶条换一遍，噪音会改善很多。    ,操控,0,
d3PvXmJIOanwVsyh,09年10多万公里的车至少是上一个款的车型了，噪音大点正常。建议你把底盘胶套、全车油水、四门及窗胶条换一遍，噪音会改善很多。    ,舒适性,0,正常
adsb2n6GuCN3cyHe,我的森是20的，刚进藏回来，在河谷地带动力衰减是有的，但总体相当给力！    ,动力,1,相当给力
oJteW3H2wXlGQOzY,老司机，动平衡做过2次了，应该没问题。四轮定位也做好，没问题，4个轮胎基本是新的，如果是后轮胎的问题，会引发方向盘抖动吗？   ,操控,0,
MJcgolKBb7kZEp4W,发电机跟空调有什么关系？不理解，发电机所耗动力可以忽略,动力,0,可以忽略
MJcgolKBb7kZEp4W,发电机跟空调有什么关系？不理解，发电机所耗动力可以忽略,舒适性,0,可以忽略
MQ2LigG9wXHDYo4R,油耗会上升，动力会略有降低，如果你要长途穿越建议你还是换吧,油耗,-1,油耗会上升
MQ2LigG9wXHDYo4R,油耗会上升，动力会略有降低，如果你要长途穿越建议你还是换吧,动力,-1,降低
th7BaOUp63NwFAIM,个人感觉发动机提取比之前快多了，噪音小了点，就是刚打火的时候动静比较大，但是转速比以前降下来快，但我不知道为什么排气管有点黑，我一般都是加91号的汽油    ,动力,1,比以前快
th7BaOUp63NwFAIM,个人感觉发动机提取比之前快多了，噪音小了点，就是刚打火的时候动静比较大，但是转速比以前降下来快，但我不知道为什么排气管有点黑，我一般都是加91号的汽油    ,舒适性,0,噪音小了点
D92PpGEwJbSIOlXA,这个不是空调就可以的吧，屁股和背心热。特别是早上起来坐上去冰凉的，再出门就算大太阳，也不会像座椅那样坐久了背心出汗。    ,舒适性,0,
JSqIdV5cl7HhPZvm,正常，空调的排水管就在右侧控制臂旁边固定的。滴水现象证明你的空调制冷效果很好。    ,舒适性,1,制冷效果好
2q3GeuPOWg4ZFlnz,这个问题说了无数次也是百花齐放！爱加9598随意。咱俩一样，我就92伺候。每次都是快到5000保养最后一箱油加一瓶大凤铝罐。妥妥的。今天加200。不忽悠。还有那些95加速猛的。我真没觉得。完全扯淡                        ,动力,0,
IbHlT0xFU9ACkYzG,马云家的显然是拆车件翻新机，不靠谱； 1.8w的料钱，几百块的油水 2w多的工时，不靠谱； 楼主不仅要换，还有加大马力，那么配套的减震刹车啥的是不是也要同步跟进呢？是不是要上涡轮呢？排气也得改了吧仅就发动机变速箱而言，工时费5000足够了。估计楼主的车距离报废发动机变速箱还有相当长的时间，到时候再说吧。,动力,0,
Hp1h9VKGtanTqSJB,原厂横滨还行，价格1200多啊！,价格,0,
rqCXELVFPQN02fak,也打算买一台2.5，但现在纠结三点：1、16款的即将面临换代；2、同样担心烧机油；3、车子今后开的时间长了，易损配件价格高，不太好转手。,价格,-1,价格高
QpyY8FzOsH9ofx3J,2.5上纳木错发动机仓都开始有点冒烟了，机油温度117，其他地方一路上没有任何毛病.2.0慎重哦。2.7的普拉多是得扔,动力,-1,冒烟了
YLnSFkJ6WIyKZuBd,我一直用的美孚全合成机油开起来杠杠的起步加速轻轻松松！,动力,1,加速轻轻松松
3lK05J4hmAiqCjdg,正确看机油方式是启动发动机到正常温度，然后停发动机，过2分钟 看油位,动力,0,
fUr1bIOWJNS2HMno,我最诧异的是方向盘下面的盖板，像纸壳，碰上去嘎嘎响。不过没关系，那个地方又不是用来碰的,操控,-1,嘎嘎响
uq2YDs71oSkRh0TN,不错，操控很棒目前不烧机油小问题么异响啊有一些些   ,操控,1,操控很棒
S9HIFJ32rRbOGLEj,一个月了，车显平均油耗都是9.8    ,油耗,0,
YEQf1oka4cKiS0qL,嗯..知道了.本来都要下定2.0的.怕动力不够...脚垫什么的都早买了...才发现还没买车..   ,动力,-1,动力不够
h6x98C1WzwIvsNGk,自驾2.0动力还是弱了点，应该提2.5的,动力,-1,弱了点
GQs2jr0dABpyfHYo,下地多少？看其它车型都不怎么满意.唯独森林人外观跟内饰都比较对口味.就看价钱了.要不然就只能降低点买其它合资车型   ,内饰,1,对口味
GQs2jr0dABpyfHYo,下地多少？看其它车型都不怎么满意.唯独森林人外观跟内饰都比较对口味.就看价钱了.要不然就只能降低点买其它合资车型   ,外观,1,对口味
1MNPZr8Uyw3dclvF,不满你说。 刺拉拉。 噶喇喇。 刺拉刺啦  这个叫爆震。 一般在1300———2000转速  急加速就有。。正品,动力,0,
mLwNh4TQ1MAOJscy,我看了一下 不是 只卖 发动机吗？他们还包改装？   ,动力,0,
03AUEJcWODxb9ZHa,建议最好使用原厂，subaru的发动机的冷却方式更别的车不一样，所以原厂更适合。   ,动力,0,
7uRZxGYeMkndvNjL,想多了，除非你能提供发动机进口的正规发票，并有换发动机的足够理由，不然，交警那根本不能变更资料。改车进把发动机号一齐改了就好了。   ,动力,0,
6vdum1OKIpthCcxq,4S店在原有优惠基础上，给加装原厂前后铝合金护板，挡泥板，换机油，发动机仓清洗。,动力,0,
kLHmZQoGu54xN7nP,动力还行，不过开着开着就没力了。呵呵，有条件2.0T   ,动力,0,还行
joIYGBucw9rN8alP,有价无市当然贵了，极品车况出手的太少了，有人找一年极品车况都没找到，玩se 的都不在乎油耗都是暴力开车。    ,油耗,0,
5YDfIqgKrZUHNRh8,30？？？ 疯了 换了SE，不管如何驾驶，油耗表都是16以上,油耗,0,
MShCxL7g9ZelNIPi,我首保后就在外面弄了，小保养机油5夸脱400元，曼牌机率56元，共456元。空滤空调滤合计125元，曼牌和博世组合。,舒适性,0,
qUuJE6zdBIoiMg3A,六万五时后轮坏了两个，13年森已经过保修期，换两个人工加材料1900，这质量哎,内饰,-1,
wFRorhzqUVEvZeb1,嘿嘿，娱乐一下，不要介意，价格最终是看买卖双方的   ,价格,0,
iSA5z0c93ZBOkWng,我的车快3年啦，7万多公里，油耗7左右，2.5豪华版，没有任何问题，每次去4S店就基本保养，4S推荐的一律不做，只是4万公里换了变速器油和差速器油，现在还在后悔不应该换。这车操控不错，比很多轿车都强，特别是跑国道过弯，特爽。,油耗,1,没有任何问题
iSA5z0c93ZBOkWng,我的车快3年啦，7万多公里，油耗7左右，2.5豪华版，没有任何问题，每次去4S店就基本保养，4S推荐的一律不做，只是4万公里换了变速器油和差速器油，现在还在后悔不应该换。这车操控不错，比很多轿车都强，特别是跑国道过弯，特爽。,操控,1,操控不错
Gi3XzEW6AwRBoZ5p,下次去就要800多了，祁连山南路那里也是，第一次单子打出来600多，然后我说下次也这个价格，售后说这个他们对于厂家的申报的价格，下次实际自费比这个要多一点，需要800多，我就呵呵了，小保养直接自己买好机油外面保养，省钱还能保护发动机，最主要宁可把4S的工时费用在好机油上面，也划算的，换个机油的工时费接近400，真的搞笑。   ,价格,0,
Gi3XzEW6AwRBoZ5p,下次去就要800多了，祁连山南路那里也是，第一次单子打出来600多，然后我说下次也这个价格，售后说这个他们对于厂家的申报的价格，下次实际自费比这个要多一点，需要800多，我就呵呵了，小保养直接自己买好机油外面保养，省钱还能保护发动机，最主要宁可把4S的工时费用在好机油上面，也划算的，换个机油的工时费接近400，真的搞笑。   ,动力,0,
eRKvJDzNnCgy4OWB,水平对置发动机的优势是比较明显的。,动力,1,优势明显
mX1y9VuZAbaM0qFB,我是郑州的车主，加个微信聊一下价格，发下微信，关注下我   ,价格,0,
lyazgWpRvkIfG3AS,我也是，3万公里以前一直92，后来发现上坡和急加速发送机有爆震，就换95，现在7万公里啦，再没出现爆震，而且的确省油啦，以前7.6，现在7.0   ,动力,-1,爆震
6KdjltkZ5PoVLNyA,跟我的一样，2.5豪华导航版，方向盘和中控可以看的出来。,配置,0,
6KdjltkZ5PoVLNyA,跟我的一样，2.5豪华导航版，方向盘和中控可以看的出来。,操控,0,
cGDWt5C6Iw8udo2n,你可以让他们改好，你发个原发动机号图片    ,动力,0,
HvUpLwZrMqY34yXG,我在浙江台州，砍来砍去也砍不下去了，只要了尾翼和底盘护甲。    ,操控,0,
qerO8hfTFv6YDI2x,内饰不抽烟不吃东西还可以保持，发动机舱用布擦不干净啊！缝隙里油泥不好搞啊！,内饰,1,可以保持
qerO8hfTFv6YDI2x,内饰不抽烟不吃东西还可以保持，发动机舱用布擦不干净啊！缝隙里油泥不好搞啊！,动力,-1,缝隙里油泥不好搞
s2DbHlfqXJ6CZOR7,做个底盘装甲加四门就行了，顺便升级下音响,操控,0,
rJkeOn4GYLq0j9pA,多少有点效果，低音调整到一半左右，音量大点，能掩盖一点其他噪音,舒适性,0,掩盖噪音
MYDJ0bE61HNgt3WZ,卡罗拉10万公里换的，换上新的，油耗动力没啥区别 森林人15万公里后考虑,油耗,0,没啥区别
MYDJ0bE61HNgt3WZ,卡罗拉10万公里换的，换上新的，油耗动力没啥区别 森林人15万公里后考虑,动力,0,没啥区别
4WFqZz2XEsQVK8C1,感谢各位，这车11年登记的，被拍到了10.95，我没敢再加，主要是放置时间长，一两年了，车况不明，还有违章。很早就喜欢森林人了，但是只好再等等了。是不是2.5的话，这个价格尚可？2.0的话，这个价格也就一般了？,价格,0,价格一般
WACXySPl3iEVFRGM,先留下   最好给个链接和价格   安装花了多少？,价格,0,
YeIuF9cEC4MHrjW1,想开的爽点就森林人，考虑家庭乘坐的还是傲虎综合好点，空间大，隔音应该好点，主要是后备箱巨大   ,空间,1,空间大
HaEILivK7CursRog,哦，看错了！应该是11款，后视镜带转向灯！但是空调按钮又像09，10款！    ,舒适性,0,
xYrbPLzg6wpZs4J1,车子挺板正。发动机舱咋这么干净？多钱出    ,动力,1,干净
QhjCIVbGoudmMr1N,差不多吧、主要是动力跟钥匙很介意.,动力,0,差不多
7V0Yj2MUtiGNuxJb,我有车库，车回到家都停库里，发动机舱自己没事就清理一下所以干净，轮胎还是原厂的优科豪马呢。价格和你出的差不多少。     ,价格,0,差不多
7V0Yj2MUtiGNuxJb,我有车库，车回到家都停库里，发动机舱自己没事就清理一下所以干净，轮胎还是原厂的优科豪马呢。价格和你出的差不多少。     ,动力,0,
cauT9SB2ZdzIerNk,2.5豪华，加装倒车影像和导航,配置,0,
gXe5NWTiMVUv7FRC,2.5也好不到哪去，要动力还得上涡轮增压    ,动力,-1,好不到哪去
6oCcPTsivIw1gSdr,还可以 就是动力下降比较明显，油耗好，发动机噪音变大    ,油耗,1,油耗好
6oCcPTsivIw1gSdr,还可以 就是动力下降比较明显，油耗好，发动机噪音变大    ,动力,-1,下降明显
6oCcPTsivIw1gSdr,还可以 就是动力下降比较明显，油耗好，发动机噪音变大    ,舒适性,-1,噪音变大
FXkUQow5B4sq1GYP,用好的机油，再加瓶发动机保护剂试试，或许噪音有所下降的,动力,0,噪音有所下降
FXkUQow5B4sq1GYP,用好的机油，再加瓶发动机保护剂试试，或许噪音有所下降的,舒适性,0,有所下降
7ufbBzrEWvIXj0OL,首先，傲虎比森林人贵好几万呢，我为了省点银子。 再就是，对我来说，森林人已经满足了需求，而且还有几点超过傲虎：天窗（确实大）、底盘更高、车短方便停车，呵呵。 而且至于电子手刹，个人完全不感冒，更信赖手动。 不过新的傲虎有自动刹车，这点不错。 经常旅游，需要带很多东西的，可选择傲虎。,操控,0,底盘更高
m7PVQLeqngDb1kTl,我原来有过这现象，都是因为发动机温度过高造成的，要不就清洗水箱，要不换个水箱试试    ,动力,0,发动机温度高
XnDkUK5aqWJSuYrs,LZ你把XT油耗降下来，但同时你也把XT的积碳升上去了,油耗,0,
1AMbcz9tpnaxvWKk,恩，开空调滴水，望采纳,舒适性,0,开空调滴水
YrRmuN1E5iHXQIl2,要是有泄漏的情况空调管路里是放不出来冷媒的，一定要按照原厂规定的加注量充装，空调排水管在右侧下摆臂后面，空调工作几分钟就会有滴水现象。把蒸发器和水箱好好冲洗一下，原厂的要是没动过问题不大。    ,舒适性,-1,滴水现象
bQx6rLFJfDiuwe7d,速度一样比别人快，油耗一样比他低。   ,油耗,0,
lGuxRFayo3hcvPXr,成都2.0豪华导航版优惠不到一万。还在等时机    ,配置,0,
T8hBdQz0PuExLoFI,我能理解你的心情，我也差不多一年了之前跟你一样也抱怨过…我买的还是xt，放弃的车型现在回想起有些后悔，不过单论开 森真的很不错，隔音内饰做工不提了 心知肚明！开几年卖了再换吧，不买的时候，每台车都是各种光环笼罩，等入手后新鲜劲过了，都会开始找茬！这价位的车都有缺点    ,内饰,0,内饰做工不提了，心知肚明
AYdLFjaTX4fWHVgu,生产日期、逐一对照协议与车的配置，车底盘有漏油不，行驶公里数，外伤，启动后仪表正常不,操控,0,
kJrX6V8hLAyKO271,坐标北京，森林人2.5顶配，优惠1.7，送全车玻璃膜、车身镀膜、底盘装甲。买的ssss店的划痕险和玻璃险1680，商业险买了4大主险，其余没有了。,操控,0,
J4vYqjXNFnWPQZlu,空调只能说是一般吧!和捷达比还是差了很多,舒适性,0,一般
U3k51Miyj6BODltY,空调是很冷，但是大夏天，感觉头顶和前面还是有点热；感觉颈部以下冷，上面热，不知大家的如何？,舒适性,0,很冷
ahE0JH3M2w5mFSTW,从冬天开到夏天对森林人最大的吐槽就是空调（冷）太不给力了，么有对比就么有伤害，我的标准是要冷不是要凉......哈哈    来喷吧 说我咋不坐冰箱里呢,舒适性,0,不给力
axGEoMTpNieRAj1q,本人比193矮10公分，座椅调到合适握方向盘的位置，膝盖就抵到方向盘下方，不抵了握方向盘就不舒服，不怪车不好，只怪自己腿长胳膊短了,操控,0,不舒服
YZ26X37A81yqdjS9,xv森林人都能上，感兴趣的私信我价格！,价格,0,
W6VhDGOflNwBxRuX,座椅和方向盘都可以调节,操控,0,可以调节
yn1MFXw8KOU3ZzB0,可以要求用原厂的机油吧，我双包卡用一年了，每次都要求加原厂机油。换过三次机油，其中第二次加完机油，明显发动机噪声大，后来第三次特地要求用原厂机油，噪声立刻小多了。谨慎怀疑第二次机油有猫腻。车友们多注意。不过第三次换所谓的原厂机油，我特地看着换，也是从管道里加的机油，到底是啥机油，不得而知。,动力,-1,发动机噪声大
a5e6TFBqSPHA3hzb,手续费是给四儿子店店，利息是给银行的，都要赚钱。又要出新车啦？我怎么听说17款9月才出啊？你这个4月产的估计是后加装的吧。这个价格建议买2.5特装,价格,0,
wZcFX1utv8kx7dE3,哥们，你一直在找SE，想必你也应该了解森林人这部车吧？11万公里对于这个车来说才是刚刚开始。尤其是老款的EJ系列发动机，我开过18万公里的09年XT，发动机声音跟我7万公里的EJ20发动机声音一模一样，并且滴油不烧！   ,动力,0,
5ktN1fFhrJyTGY07,这不是挺好吗？这才能彰显斯巴鲁车主的尊贵身份啊，我希望一个灯卖5万，这样搞6个灯就可以抵得上一辆原厂的价格了,价格,0,
X1IGuM3bO5kAtLEg,空调压缩机，温度低于5度时它就停转了，一会又启动了，这个也是为了节能，正常,舒适性,0,正常
qC9LAi6pwdxUvXP2,自由光油耗确实高，车太重，同事四驱的1.85吨，比沃尔沃XC60都重，跑高速都是8、9个油。开过几次，最不能忍的是变速箱太差，一脚踩到3000转不换挡，据说要先轻踩一下，给个信号，再往下踩才会换挡。唯一的优点就是地盘好一些。噪音方面，主要是小森的发动机隔音太差，克雷嘉都好很多。    ,油耗,-1,油耗高
qC9LAi6pwdxUvXP2,自由光油耗确实高，车太重，同事四驱的1.85吨，比沃尔沃XC60都重，跑高速都是8、9个油。开过几次，最不能忍的是变速箱太差，一脚踩到3000转不换挡，据说要先轻踩一下，给个信号，再往下踩才会换挡。唯一的优点就是地盘好一些。噪音方面，主要是小森的发动机隔音太差，克雷嘉都好很多。    ,动力,-1,变速箱差
