content_id,content,subject,sentiment_value,sentiment_word
9NeSiBFJ2GXOrQmR,调教的问题，xt起步就是涡轮不介入也比2.5的动力强，根本不是一套发动机，一个fa一个fb。而且xt涡轮1500左右就介入了。只要你舍得踩还是xt快。,动力,0,
OetJGFnpLR6uy4QM,我以前碰到过一回，发现是后排座椅翻倒后翻回去没有卡稳，重新弄弄就好了！,内饰,0,
pO7qoSKg8LfuMiRd,唉，本地4S已无白桶，也不知道它们用的什么垃圾油，油耗高噪音大，价格还死贵，简直失望至极。,油耗,-1,
pO7qoSKg8LfuMiRd,唉，本地4S已无白桶，也不知道它们用的什么垃圾油，油耗高噪音大，价格还死贵，简直失望至极。,舒适性,-1,
pO7qoSKg8LfuMiRd,唉，本地4S已无白桶，也不知道它们用的什么垃圾油，油耗高噪音大，价格还死贵，简直失望至极。,价格,-1,
nuOzKChxTgVIsF6a,没有就没有吧，森林人空调还算给力，最遗憾的是没鹰眼和导航音质太差，其他都不算啥问题,配置,-1,
nuOzKChxTgVIsF6a,没有就没有吧，森林人空调还算给力，最遗憾的是没鹰眼和导航音质太差，其他都不算啥问题,舒适性,1,
lURiBHD0sPjmrXpM,请问楼主你的森林人中控显示屏控制键和方向盘背板是在哪一家买的？能否发个私信说下？还有能找到那几个原厂配件编号吗？谢谢你,配置,0,
lURiBHD0sPjmrXpM,请问楼主你的森林人中控显示屏控制键和方向盘背板是在哪一家买的？能否发个私信说下？还有能找到那几个原厂配件编号吗？谢谢你,操控,0,
8Uw5f7WA6EvbQ1st,楼主你好，换机油、机油滤清器、空气滤清器、空调滤清器、汽油滤清器，还要检查一下发动机、刹车系统、底盘，转向系统及尾气排放，轮胎磨损等，这个直接去4s店就是了,舒适性,0,
8Uw5f7WA6EvbQ1st,楼主你好，换机油、机油滤清器、空气滤清器、空调滤清器、汽油滤清器，还要检查一下发动机、刹车系统、底盘，转向系统及尾气排放，轮胎磨损等，这个直接去4s店就是了,操控,0,
8Uw5f7WA6EvbQ1st,楼主你好，换机油、机油滤清器、空气滤清器、空调滤清器、汽油滤清器，还要检查一下发动机、刹车系统、底盘，转向系统及尾气排放，轮胎磨损等，这个直接去4s店就是了,动力,0,
8Uw5f7WA6EvbQ1st,楼主你好，换机油、机油滤清器、空气滤清器、空调滤清器、汽油滤清器，还要检查一下发动机、刹车系统、底盘，转向系统及尾气排放，轮胎磨损等，这个直接去4s店就是了,安全性,0,
FR27nxucH6p1vjbN,早些年开奔腾还跑过180，现在开森林人最快到过140还是偶尔加速超车的时候,动力,0,
JFmsSe458kUPQ2VG,美丰剎車盤原装位盘 ? 菲罗多刹车片,安全性,0,
0AQh3PyTN75VtS9c,全时四驱应该没有必要吧？,操控,0,
NXfsMzVpjbnY513F,照楼主说的试了，不成。16年10月的车，但导航可能是今年加装的。,配置,0,
f4wSvq0dtsZJrTMG,加个5W够2.0时尚的落地了。分期下没多多少钱。配置还差了不少。何必。两年6W公里也没少跑。,配置,-1,
51GIS9Q0rfzBZsLA,有皮不坐套个套干什么。哪那么容易坏。要坐套子干嘛不买织物座椅的车,内饰,0,
WNG9RE6ToIpM8rlm,我觉得森的噪音还是控制的不错，至少比我原来的小福强不少。,舒适性,1,
h7NFb5CoZ30J91Ry,导航比较鸡肋音响差了一点 其他都很好 我现在基本天天都要开出去溜一溜 一天不开难受,配置,-1,
6Kgc0OVfQuSW9toU,而且冷启动声音可以用轰鸣来形容，热车相同的转速声音反而很好听，听说是鬼子在零下几十度装配的发动机，是否装配过于紧密不得而知。,动力,0,
TROcqp2QVm0ZfPYB,路况好，可以做到。我的不开空调国道5升油耗，开空调5.8。开空调明显上升油耗,油耗,-1,
DtIsWbC1aYwjydEN,我发觉16款发动前钥匙先放在ACC位置，再起动，发动机转在2000转左右，声音比较轻，直接起动，发动机转速表要升到满格左右，发动机声音很响。,动力,0,
DtIsWbC1aYwjydEN,我发觉16款发动前钥匙先放在ACC位置，再起动，发动机转在2000转左右，声音比较轻，直接起动，发动机转速表要升到满格左右，发动机声音很响。,舒适性,-1,
PHQfc30DwMF8ILE9,斯巴鲁的车凉车启动后的发动机 的声音确实不敢恭维，太大了，空调凑合可以用，要是放太阳下晒的时间长了确实要把温度降下来很困难的,舒适性,-1,
PHQfc30DwMF8ILE9,斯巴鲁的车凉车启动后的发动机 的声音确实不敢恭维，太大了，空调凑合可以用，要是放太阳下晒的时间长了确实要把温度降下来很困难的,动力,0,
TizDfoyWwxK47C89,2.0的吧，跑出这个油耗不奇怪,油耗,0,
hvVkQTp9G5CWPcSz,不开空调，国道5.0，匀速60左右最省油，正常得很。一路畅通。昨天开了120公里，开空调最后综合油耗6.4。,油耗,0,
hvVkQTp9G5CWPcSz,不开空调，国道5.0，匀速60左右最省油，正常得很。一路畅通。昨天开了120公里，开空调最后综合油耗6.4。,舒适性,0,
elGQ1c9E5gDAxTjh,我指的是有些时候、有些路段。大城市油耗啥车也低不了！,油耗,-1,
ZXF28a4K7zy9kmS5,金属性的清洗剂与无灰分散剂能够有效清除发动机活塞环及缸体的积碳，对各种苛刻条件下工作的发动机提供完美的保护,动力,0,
L90eShujpnvtB6KV,那是笨重不叫稳哦，越满载越不能快。随着载重增加操控性会越来越差，刹车也很重要，跑车快人家刹车好。,操控,-1,
L90eShujpnvtB6KV,那是笨重不叫稳哦，越满载越不能快。随着载重增加操控性会越来越差，刹车也很重要，跑车快人家刹车好。,安全性,1,
uYgQF82KaZLds4UW,我16年10月份的，基本上就是安全带卡扣掉出来的碰撞响。没有其他噪音,舒适性,1,
UJ3XyQLtB5CIaFPH,脚下比较狠，常年维持在8L，2.5排量四驱车斯巴鲁油耗确实不错。,油耗,1,
7S01lR2o3DxEqVg4,D挡没问题，如果想动力更好一些可以换低档。,动力,1,
xzIdmSbP4Jl5UiHR,不错了，我的指导价优惠五千，送了前置雷达，贴膜,配置,0,
FySCt6x1KIz9G3HN,你住哪跟你去哪，已经决定了你的基本油耗了，任你脚法再风骚，意识再好，耐用再强，也无法突破路况带来的客观束缚,油耗,0,
QhB9nAuFgH3P6yEr,正品。刹车片软。跑完换别的品牌的就不响了。,安全性,0,
4NmTPBYqG1J3FCUo,上一代很多配置是车友们看不到的实在。这一代内饰配置多了。但是关键的配置却简配了。有点华而不实。而且显得没有上一代车型敦实。,配置,-1,
4NmTPBYqG1J3FCUo,上一代很多配置是车友们看不到的实在。这一代内饰配置多了。但是关键的配置却简配了。有点华而不实。而且显得没有上一代车型敦实。,内饰,1,
zUBXMu0iHV5AmyPO,价格不菲吧？  口水一地呀！,价格,-1,
DkSUI71Aca43hM2O,楼主这个油耗厉害了我的亲,油耗,1,
3qmwcRgBIpXQuL1N,正常现象，我的提车没多久就开裂生锈，自己点了点漆了事，森林人的做工确实非常一般。,内饰,-1,
ekzX7h50PgbVdulZ,你们都是怎么开出来这么低的油耗的,油耗,1,
vqt39TA1MUcjbg7B,后座垫的两边黑色内饰面板,内饰,0,
rtxkgzH5ShlvQuW1,我刚买的豪华，比时尚便宜，该有的配置都有。那些外观套件神马的都是给别人看的。,外观,0,
rtxkgzH5ShlvQuW1,我刚买的豪华，比时尚便宜，该有的配置都有。那些外观套件神马的都是给别人看的。,配置,1,
rtxkgzH5ShlvQuW1,我刚买的豪华，比时尚便宜，该有的配置都有。那些外观套件神马的都是给别人看的。,价格,1,
atUfXbKidH0pZV31,我的也碰到过，不过是打了好长时间方向盘，完全没有助力，过了2个小时，重新启动好了，可能是电机热保护,操控,0,
r4advZDgEVYSkUlI,挂M档要松油门吗？在D档正常行驶中，要爬坡加速，直接到M档吗，不松油门。,动力,0,
PJeRV3kcoQizNWM5,12款森林人2.0减震器多少钱？,舒适性,0,
qyLlJS1maGjPigZN,没区别，动力不同配置差异而已。另外森林人新款只有2.0T2.0L2.5L三种,配置,0,
qyLlJS1maGjPigZN,没区别，动力不同配置差异而已。另外森林人新款只有2.0T2.0L2.5L三种,动力,0,
lPpMYaT04hSvqe3V,在开了两千公里之后，我认为是换了车之后操控习惯及方向盘手感不同，以及心理暗示的问题。现在习惯之后感觉没问题。谢谢大家??,操控,0,
MQlyYNtae7hugow2,一摸一样 后备箱我准备把备用工具拿掉试试。待高手解答,空间,0,
HSFUvVTwMtfj73WR,手动空调的时候启停是不启动的,舒适性,0,
ojEQTCkdw7VUzSXu,从买来就响，一年了，4S店也修了一年了，该拆的都拆了！找不到原因！把车顶，安全带，座椅，后备箱一切东西，全拆了，就剩个车架子，还是响。,空间,0,
ojEQTCkdw7VUzSXu,从买来就响，一年了，4S店也修了一年了，该拆的都拆了！找不到原因！把车顶，安全带，座椅，后备箱一切东西，全拆了，就剩个车架子，还是响。,内饰,0,
s8gMoOdDjmbuxYUX,主要是方向盘助力问题吧,操控,0,
VNlAaSid9Tn6DeK7,新指除了一款高性能版，主力车型全是双离合了吧?那还不如CVT。。。新指铁定不如自由光。,操控,0,
VNlAaSid9Tn6DeK7,新指除了一款高性能版，主力车型全是双离合了吧?那还不如CVT。。。新指铁定不如自由光。,动力,0,
spIcqzgmvNkoEjWb,用的材料不一样，放心吧。,内饰,0,
ASxFWfDhOVQ2jstY,车子停下后怠速开空调负荷较大的情况下，启停是不工作的，也是对车子电瓶的保护。,舒适性,0,
RLU3KAgCopWX1T9s,是EJ发动机可能是三元的问题。换三元,动力,0,
0pcRyjmVLIFn8zaW,安全不超速下肯定足够了啊，大不了就是油门踩深点，红线下都是给你踩的嘛。真要追求提速感，那就轿车，凯迪拉克ats-l，品牌、价位、性能都拿下了。,操控,1,
0pcRyjmVLIFn8zaW,安全不超速下肯定足够了啊，大不了就是油门踩深点，红线下都是给你踩的嘛。真要追求提速感，那就轿车，凯迪拉克ats-l，品牌、价位、性能都拿下了。,动力,1,
aEHdJpwsBXMKqCPn,换过方向机，师傅水平不高，把我的搞坏了。气囊没有弹开过。,安全性,-1,
29hNZ53OLzKpbqGQ,这个我自己也没有试过，不建议这样做，因为踩油时动力是有衔接的，我们开手动档换挡都要收油门的，大概就是这个道理了。个人意见。,动力,0,
k63HI2eFuWEVPnYz,凯路德k1 plus，雷达测速加云狗自动升级的，测速效果很准，使用现在跑高速一直用它。记录仪的广角很大清晰度高，自己可以看下这种性价比还不错,配置,0,
PWCMOabsHyruL1ji,装了这个后高速风噪大，而且很多地下车库有可能超过高度，确实也不是非常有必要，装行李杆就可以。日常来说尾箱够放东西的。,舒适性,-1,
JrBI4Gc5UqnRks7m,最好别装，车速达到120时，噪音很大，,舒适性,-1,
gZzDJqmVC6FrBys1,价格多少？有两条补过，,价格,0,
ECDsGcTi5Ao6F4jt,是的，13款2.5的基本上都换过发动机了,动力,0,
Hj5OJGCFWsaEKBpX,我也有这个问题，基本上跟你一样。比如能打两圈的方向盘只能打一圈就打不动了,操控,-1,
KTvfNFwqWgbZcOBE,金属发动机部件，热胀冷缩所致，正常,动力,0,
z9iZe3CHUmj6vao8,自动启停的BUG还有很多，稍微一点下坡就失效，开了后窗除雾（后视镜加热）也会失效，方向盘没回正也失效……,操控,0,
zoaH9i7CepZkILOr,是下坡吧，160 油耗指针还在右边？,油耗,0,
dYyphkDCQ4gXlMrW,2.5没有实时油耗指针吗？,油耗,0,
1Q8PDUu20szawjG9,各位大神，我打算4万换...重点是变速箱油用哪种,动力,0,
ZGCfI4agPTlFDiW5,后排内饰板在使用时候最好把安全带扣拉到上头，不然容易摩擦花掉内饰板影响美观，严重的裂开都有。,内饰,-1,
wClEHvkZ5nh9seDY,一百五六没问题。只是110之后加速慢。刚开上去就有限速什么的,动力,-1,
nUqFNJ74vXLO0ZAs,现在9万1公里，但是不知道表是不是实表，所以都没办法确定是不是换过。变速箱油肯定得换，因为油封渗油，得换油封一起换了,动力,-1,
1U9sBS6zWmDcy8LJ,那不是调座椅加热温度的嘛？,内饰,0,
Yl79f3qrvztnpTsB,和森有啥关系？一般的手动、自动汽车空调都这样设计，外循环优先而已。,舒适性,0,
WMnVwmqJrH1FuhBQ,有没有哪位大侠把这个机头改成安卓的，我实在受不了原来的导航炫光，花了60元改成凯立德导航了。,配置,0,
rFopaKcM0ZYRDCy1,森林人，生命的动力!今天长驱六百余公里，咋没觉累呢？,动力,0,
1AFNwOJXP730oL8b,空调我觉得不错啊，西安高温时真的受不了，我温度一般调到23，再低就感觉挺冷了，媳妇带孩子坐后排都说冷,舒适性,1,
t6SBqvE9dzKLJHhW,4S店看到有DIXCEL的刹车片展示，看到论坛中有问DIXCEL的问题，上DIXCEL网站学习了一下，也分享给大家，只是发帖不熟练，文章没有连贯性。,安全性,0,
P9cpDnN1HyaGwZmE,在d挡直接用换挡拨片就会手动加减档，需要急加速可以使用直接降档，过几秒自动变回D档。,动力,0,
8uMqz5DjQGBwfW1U,我只知道整车喷漆价格：大约8000，这是4s报价。外面国产漆在3000左右，进口漆在4500左右。,价格,0,
qBnTOzmW7ucvilRC,预算有限就买吧，17款森只有高配才会跟16款有鹰眼的差别，对后排空间没要求CX5也不错，对内饰没要求欧蓝德也很好，奇骏也可以，就是性价比也不是太高,空间,1,
qBnTOzmW7ucvilRC,预算有限就买吧，17款森只有高配才会跟16款有鹰眼的差别，对后排空间没要求CX5也不错，对内饰没要求欧蓝德也很好，奇骏也可以，就是性价比也不是太高,内饰,1,
YjdMBRXl7GeN1a63,NX200变速箱修烦你！,动力,0,
HZuWUfAj1c4Xrnoh,车身抖不抖？看下四轮平衡,外观,0,
xiJPVaC8jLn0RYsK,中控中间按钮，三联显示，看说明书吧,配置,0,
iR1sOXjpArgb2C4P,空挡溜车确实不上伤车。陈震在萝卜里说过但是影响安全性。,安全性,0,
nv5OwoRlf7LkVQK2,正品都这样。响声越大发动机工况越好,动力,0,
FmfDwARxad2oJjTQ,这是电动下滑屏幕，要留空间给屏幕下滑，其实是没任何缝隙的,空间,0,
C7GfrSIZYQKaUAew,不要和rav 4比，rav4没有性能，就一辆车而已,操控,-1,
C7GfrSIZYQKaUAew,不要和rav 4比，rav4没有性能，就一辆车而已,动力,-1,
MGguLz20oByQ7ASf,花了20块，换了两个。修理工说这是设计缺陷。刹车灯的灯座铜片太薄，被压坏了，所以很容易坏，也没啥好办法，要根治得换灯总成。,安全性,-1,
XckA5quzYPbFlns2,对啊。全时四驱没有那么娇贵。自己看看说明书。方向盘里还有一个保险。是断开后桥的。也就是两驱。长时间拖拽也可以这样,操控,0,
jVCA8S0qEuYO2wHX,电瓶一定要好好看，之前在库里电瓶是断电的，再接上可能会出现问题，电瓶应该是日本原装，上面为日文，多开电器空调试试，原装进口是很耐用的,舒适性,0,
5dgEkKx7NvqjtbB9,自由光2.4L，很多人反馈动力不足，车重了，而且前脸那眼睛??实在难看,外观,-1,
5dgEkKx7NvqjtbB9,自由光2.4L，很多人反馈动力不足，车重了，而且前脸那眼睛??实在难看,动力,-1,
rjUpf5wqDZ7nJ4AO,自己有过两辆车，开了累计9.3w多公里。自认为即便不算老司机也不是新手了，曾经自驾游一天高速开过将近1300km。但这车高速上方向盘真的很轻，很不适应。,操控,-1,
ETHSWqRC0tK5p2De,前几天去杭州，坐了一下荣放，底盘太硬了，舒适性跟森没得比，内饰也是挺寒酸的，噪音控制一般,舒适性,-1,
ETHSWqRC0tK5p2De,前几天去杭州，坐了一下荣放，底盘太硬了，舒适性跟森没得比，内饰也是挺寒酸的，噪音控制一般,操控,-1,
ETHSWqRC0tK5p2De,前几天去杭州，坐了一下荣放，底盘太硬了，舒适性跟森没得比，内饰也是挺寒酸的，噪音控制一般,内饰,-1,
zH8s51WXDbcOdyF2,加行李箱风阻肯定会大，风噪会随之增大,舒适性,-1,
9iRyOkZLJ4Nte0QG,17特装就是16款2.5豪华的基础上多一键启动、电尾门、银色行礼架和棕内饰，没有尾翼的。,内饰,0,
SWj3kbXqBLxgTyYf,很多车都有这种设置，要不然，你玩中控屏跟玩手机有区别么？,配置,0,
ITwaWKSj37foBtRp,恭喜恭喜，麻烦PM下价格,价格,0,
a8yBGz1UwWXPrfZ0,空调启动后按AC当然关掉了，但有什么方法让他一开始就只出风，不启动空调？,舒适性,0,
iDX8r3F5kxNcatop,我是迫于无奈装了个前顶吧，个人感觉心理作用大于实际作用，今天下午还得去装个底盘井字架,操控,0,
0pSD3woJGuZmHB6j,请问坡上n档松刹车车会停着不动吗？,安全性,0,
k1Q5XsRKe9U8g6Oj,这款现在是什么价格？？,价格,0,
sU0rCp8iEKwF2QMT,不知道这一路下来，感觉车的性能怎么样？,操控,0,
sU0rCp8iEKwF2QMT,不知道这一路下来，感觉车的性能怎么样？,动力,0,
WKoiB3ZjdzcPD5rO,这车看着挺好的，性能怎么样啊？,操控,0,
WKoiB3ZjdzcPD5rO,这车看着挺好的，性能怎么样啊？,动力,0,
c92ns1LKa4VgNYyQ,车的性能稳定，外观也大气，值得推荐,外观,1,
c92ns1LKa4VgNYyQ,车的性能稳定，外观也大气，值得推荐,操控,1,
c92ns1LKa4VgNYyQ,车的性能稳定，外观也大气，值得推荐,动力,1,
kG1tITviwqzc0bHn,优越的安全性及便利性配置，要是价格再低一点的话，诸多人性配置，真让我心动,配置,1,
kG1tITviwqzc0bHn,优越的安全性及便利性配置，要是价格再低一点的话，诸多人性配置，真让我心动,安全性,1,
kG1tITviwqzc0bHn,优越的安全性及便利性配置，要是价格再低一点的话，诸多人性配置，真让我心动,价格,0,
LoKjIQwZy1rN9Osn,发动机附近应该有 打开机盖看看,动力,0,
mdtrAH72ZkNSIznO,这个车的变速箱在拨杆的正下方，而且是硬链接，所以不能以其他的前驱车拉线变速模式评比，如果你觉得很厉害就去看看，但是正常情况它也比其他车型抖,动力,0,
GedUaXF0yc7KqVI3,我觉得有点贵，我买31万2016款 2.5i 尊贵导航版,配置,0,
GedUaXF0yc7KqVI3,我觉得有点贵，我买31万2016款 2.5i 尊贵导航版,价格,-1,
iexjFnqNCgf5rtD0,楼主，我去年8月从阿里回来，单人单车(2.0T)5000公里左右，油耗5.8,油耗,0,
Gw3cZK2j5gPRFIsD,买性能车的，有几个行车习惯好的哦！,操控,0,
Gw3cZK2j5gPRFIsD,买性能车的，有几个行车习惯好的哦！,动力,0,
SfmPpiQk0rgl6MtV,不用纠结 高档车都有这些，汽车之家找到高级点车型看发动机舱图片就知道了。不差钱前后一起装了,动力,0,
Jwci3U68EI1GvCX4,乘坐空间森大 尺寸自由光大 操控动力森好,空间,1,
Jwci3U68EI1GvCX4,乘坐空间森大 尺寸自由光大 操控动力森好,操控,1,
Jwci3U68EI1GvCX4,乘坐空间森大 尺寸自由光大 操控动力森好,动力,1,
xQ1h7qnagbjWiB4o,你这样操作，油耗很经济，确实很值得借鉴!,油耗,1,
3GlUw0R6DIuAOZeP,嗯嗯，有道理，我看了些帖子，说EJ和FB的发动机不一样，FB的烧机油,动力,-1,
Ec1i53e7XoDCWSAp,有，在中控上边的小屏幕里,配置,0,
VuhZXlag6xvJGBLj,森林人除了内饰掉渣，其他应该可以完胜自由光,内饰,-1,
IGiwEM2LdAh4BjSz,自由光的内饰也好不到哪里去……16款森的内饰提升很大，其实并不掉价了！不过自由光的发动机静音确实做的不错！,动力,0,
IGiwEM2LdAh4BjSz,自由光的内饰也好不到哪里去……16款森的内饰提升很大，其实并不掉价了！不过自由光的发动机静音确实做的不错！,舒适性,1,
IGiwEM2LdAh4BjSz,自由光的内饰也好不到哪里去……16款森的内饰提升很大，其实并不掉价了！不过自由光的发动机静音确实做的不错！,内饰,-1,
f4CWr6IlFtehkmij,其实不是虎鲨发动机声音小，而是自由光前排是双层隔音玻璃，另外隔音也做得比森到位。,舒适性,1,
zVy5Oin6dZQf3tha,可以肯定不是，我的是at变速箱,动力,0,
fj6EpvBtg74nyFuc,我的价格你肯定认为高，但是是我能接受的底线，20万。,价格,0,
PC2X4lEwSj8KDybt,想问一下建伍导航在哪买的,配置,0,
njiQlv5gk4PItxMJ,隐形车衣必须做 车漆薄的…石子上去就见铁 我已经被石子甭的没脾气了,外观,-1,
CU0QFzaDincBvoKg,大连哪一家？什么价格？,价格,0,
E5O9FG1vZT7iRBbI,新车有一点糊味，我当时也是；新车经常开窗；如天气热，开空调就外循环，几天味道就散了，比其他车要好太多了。,舒适性,-1,
DKW7T9c8JgRh3mOq,我今天去了解了一下，2.5尊贵导航，32.5万，什么都不送，包牌。其实我也不太喜欢斯巴鲁，我想买锐界，但是我老婆就喜欢森林人，觉得锐界她开不了,配置,0,
Ni6spufoc0xBng1h,都好低呀，我10万多公里了，平均油耗常年在11.4到11.7之间徘徊，12款2.0的,油耗,0,
2Q8bwcPhanKuoDWy,怎么说呢？对动力没什么要求的人就算100马力也会觉得够.....对动力要求高的人300马力也不够！这个要看人，与车无关.,动力,0,
mbMAsNcDHQ3qJlo2,车一年多了，车载导航从来没开过，想想就知道不好用！,配置,-1,
o3izO0rZpAnVBbYc,这车导航就算了吧，真心弱，更新还要800了，还是手机导航好使。,配置,-1,
xEC36XhJfsP9LrRU,车身镀膜，玻璃膜，刹车顶，前平衡杆,外观,0,
yJSBANHoMi1lWer3,指南者普遍都说起步肉，欧兰德越野不够森林人好，个人推荐森林人，操控性好，全时四驱。,动力,-1,
yJSBANHoMi1lWer3,指南者普遍都说起步肉，欧兰德越野不够森林人好，个人推荐森林人，操控性好，全时四驱。,操控,1,
oyz0XcNHAh9FqnJL,我用的就是金美孚0W-40的，一壶刚好5L全倒进去了？新疆主要夏天温度还是有点高的！盘山路啥的空调开着经常100多度，好像也没看出来机油有损耗！,舒适性,0,
nDKvid9UIo8RM2b1,我2.5尊贵，最好的时候40km不到，油耗6.2，平时市内开的话，怎么也得9-11个,油耗,0,
rKtJeikghL84n0IO,感觉如何？油耗和静音？重量大么？,油耗,0,
XAlyRGQwStP9U1Kk,2.4指南者尺寸、空间小了。其余2个自己拿主意。,空间,-1,
FPAHSTG29sZMI3kh,推荐森林人 我是13款的 4年多了 没出过任何问题 同级别性价比非常高 操控 越野 性能 空间 视线 安全性 非常省油,空间,0,
FPAHSTG29sZMI3kh,推荐森林人 我是13款的 4年多了 没出过任何问题 同级别性价比非常高 操控 越野 性能 空间 视线 安全性 非常省油,操控,0,
FPAHSTG29sZMI3kh,推荐森林人 我是13款的 4年多了 没出过任何问题 同级别性价比非常高 操控 越野 性能 空间 视线 安全性 非常省油,动力,0,
FPAHSTG29sZMI3kh,推荐森林人 我是13款的 4年多了 没出过任何问题 同级别性价比非常高 操控 越野 性能 空间 视线 安全性 非常省油,安全性,0,
uExDlgYKHR6h2eyU,就好比在高速或者国道上碰到开得老快的大货、大巴、面的车，我从不在弯道上超他车总是在直线路面上加速远离。无他，担心这些个车车弯道不减速失控而已,动力,0,
olU48cd3btKXGeJu,用车载导航不能少一步，设置目的地后，一定要看一下整个地图的线路规划情况是否正确，再导航。如果打开导航，目的地设定后就跟着走，结果就难说了。,配置,0,
gesV264nBqzf3MJj,牛逼 森林人一代不如一代了 老款sg的底盘 才是森林人的巅峰,操控,0,
cwMoxN8GqHusDijC,是全时四驱么？刹停一个随动的车轮和一个有动力的车轮，需要的力度不一样的。,操控,0,
cwMoxN8GqHusDijC,是全时四驱么？刹停一个随动的车轮和一个有动力的车轮，需要的力度不一样的。,动力,0,
0TxG2B39AFQjVgvH,指南者内饰糙 欧兰德内饰薄,内饰,-1,
nDzt3JA9bGUurVv6,从外观上看JEEP真漂亮,外观,1,
2IuCL3FeYrEAyndN,看价格，图实惠。谁便宜就买谁。,价格,1,
VH5Z3LTWK9Qig42l,方向盘选择很多，为啥要换原厂的呢。,操控,0,
HQkafFjn4gbxTY3L,我是淘金麒麟的，价格不贵，先换前面，试用不错，后面也换了，相对原厂的好。,价格,1,
Hsy7DcVSqxmkAUgl,看有不少车友提到发动机暴震问题，我倒是从没发生过，看来运气不是很差。,动力,0,
LAiORIJtfVjHmgNl,是的，估计就是刹车皮的摩擦音,舒适性,-1,摩擦音
uUlty7CZ8rRPkHjD,换了好多个了，我的也是16款时尚导航版，要试的都试过了,配置,0,
HCiNqA0eyk6ROn1L,精致的做工加上时尚的外观没有理由不喜欢这样的车车,外观,1,
HCiNqA0eyk6ROn1L,精致的做工加上时尚的外观没有理由不喜欢这样的车车,内饰,1,
TsFbjpgeq7aQcYDf,车头的标不错，内饰也好，重在材料上了,内饰,1,
u9WZz83QAxkSiIro,细节方面到位，别的方面就更不用说了，内饰杂样啊,内饰,0,
yrjSe9A6siJEg35D,耗油比较少，发动机也挺不错的，这款车性价比很好。,动力,0,
Fz3Y86VtdaXQ2TGy,喜欢森林人的外观，感觉线条比较流畅，大气,外观,1,
aNn8HpmGlyOtSfBd,森林人的外观很赞的，我第一眼看到的时候就喜欢上了呢,外观,1,
XnJ5GqlujdC7ky4x,外观细节上确实相当不错，品质方面不知道如何。,外观,1,
XnJ5GqlujdC7ky4x,外观细节上确实相当不错，品质方面不知道如何。,内饰,1,
gnDvp1kjhwX4PIl3,赶脚着吧，森林人的空间大，利用率高,空间,1,
T0MvXBH7SJZ5gpOC,你的视频里森林人很稳健 而且高速再加速的性能不是1.6NA做得来的,操控,0,
