content_id,content,subject,sentiment_value,sentiment_word
ETD5tvVzKLboI3sB,价格有点低了。。。找个专业人士看看吧。。。别光看漆。。。要看看老三样。。漆什么的其实不重要,价格,0,
L4yZTSpzemlIHxW8,合页，就是掀开后备箱之后，后备箱盖顶跟车身连接的那,外观,0,
L4yZTSpzemlIHxW8,合页，就是掀开后备箱之后，后备箱盖顶跟车身连接的那,空间,0,
nNK5f1olvExeCZWB,当然森林人啦，和保时捷一样的水平对置发动机，加上全时四驱，不要说马自达，连bba都不放在眼里啦,操控,1,
nNK5f1olvExeCZWB,当然森林人啦，和保时捷一样的水平对置发动机，加上全时四驱，不要说马自达，连bba都不放在眼里啦,动力,1,
4nqQEVHaotxm96Zb,那也是土豪啊，有钱真好，我要存钱换刹车盘和片，哈哈哈哈，经济提升刹车性能,操控,0,
4nqQEVHaotxm96Zb,那也是土豪啊，有钱真好，我要存钱换刹车盘和片，哈哈哈哈，经济提升刹车性能,动力,0,
4nqQEVHaotxm96Zb,那也是土豪啊，有钱真好，我要存钱换刹车盘和片，哈哈哈哈，经济提升刹车性能,安全性,0,
qE4NmMFT8Qxhny2j,这价格可以啊！广东哪儿的？,价格,0,
DLleKfnHyhja2RS0,看楼主自己拆过中控，请问中控面板是不是可拆分为出风口、导航、空调旋钮三部分，并非一整块，更换时难道就不能用原车出风口面板，只更换导航处面板?,配置,0,
DLleKfnHyhja2RS0,看楼主自己拆过中控，请问中控面板是不是可拆分为出风口、导航、空调旋钮三部分，并非一整块，更换时难道就不能用原车出风口面板，只更换导航处面板?,舒适性,0,
maZzdoFNJv8p4nug,陈唱的价格是可以，比珠海这边强多了！订车前也打电话咨询过！,价格,0,
h1sfgNR7YV0oEQdu,发动机左侧是不是漏油，三灯是不是亮，速度上去是不是有飞机轰鸣声。三大毛病,动力,0,
08aDjq6INsPQpcnJ,有的，到国内被改成导航机了，我当时买车时候原厂cd机也同时给我。虽然改了导航机但是dvd功能还能播放cd。,配置,0,
MGcQvUo769zIyBZr,提车一年整的车主发来贺电，2T可以，现在赶脚动力还是不够用，比如和AMG同时红绿灯起步时必须S#，起步也被BYD唐秒过，国货做得这么好也挺欣慰的。动力这东西真不嫌多总觉得再强一点就好。,动力,0,
Kd6VmD8WUnzsx1Pw,没低速四驱，底盘没大梁有鸡巴用！,操控,0,
e3BxbTip5LPrKQv7,那边多少钱，2.0时尚导航版,配置,0,
MKihPncV0mowS7qf,在你的价格上加3000-5000元，不过我订的是2.5尊贵，比陈唱的报价贵5000,价格,0,
zmCE0xpugfMhlT89,车热了也抖的，跟新车无关，我的都几万公里了。可能跟变速箱有关，停下来不熄火的话挂空挡就好了。,动力,0,
j8wfX1nbo4NCJRWu,空滤KN的，空调滤有个绿的日本的，100来块，效果不错，机滤曼牌，纠结啥！别信楼上说的小厂杂牌的，这东西表面一样看不出来，进气量和过滤程度是有区别的,舒适性,0,
5labmWvxAMLd6z1k,那个USB是用来插U盘听歌的，要充电的话从中控下方或者扶手箱引出即可,配置,0,
FzAQ4tqlMYsTvXP7,底盘装甲要看你是否经常跑烂路，是否在沿海或者潮湿地区吧，最主要起个防锈蚀的作用，如满意请采纳。,操控,0,
QIYdvp8WfV9XsGLr,新车有必要底盘装甲，底盘装甲能隔离泥土，防止底盘被腐蚀，还有一定的隔音的效果。价格在800-1200左右,操控,0,
QIYdvp8WfV9XsGLr,新车有必要底盘装甲，底盘装甲能隔离泥土，防止底盘被腐蚀，还有一定的隔音的效果。价格在800-1200左右,价格,0,
Sl0vChWAtMHLK5OE,2.0t两边自带塑胶护板，铝合金发动机前护板,动力,0,
PIxGcpwaVkqMfNLz,昂科威没啥真实越野性能……颈畅还不错…森林人就不用说了,操控,0,
PIxGcpwaVkqMfNLz,昂科威没啥真实越野性能……颈畅还不错…森林人就不用说了,动力,0,
xJkZz8pOsma5LoVW,我刚接车点火时，抖得我怀疑人生，用了一个多月，冷启动高怠速还有些抽，后来就好了。我一直是按说明书用高怠速热车的，深怕发动机出问题，特别是磨合期，现在完全不担心,动力,0,
01X4vSqHci6NPYBy,开的2.0？在西藏动力如何？,动力,0,
KFtdSQ7ZrkfM8oYN,新森发动机噪音大是普遍问题，应该是隔音设计有缺陷。怠速抖动我也有，而且感觉比较明显,舒适性,-1,
KFtdSQ7ZrkfM8oYN,新森发动机噪音大是普遍问题，应该是隔音设计有缺陷。怠速抖动我也有，而且感觉比较明显,动力,-1,噪音大
Xwz76EuNrFt5eWxB,我买的价格还可以，大家想要的联系我,价格,0,
0sBatylL5VM6DCIF,建议你还是用5W30或0W30，20黏度太低，抗剪切肯定差，易造成发动机磨损！20黏度只是油耗低而已，难道你没有发现用20机油急加速高转有嘶吼声？,油耗,0,
0sBatylL5VM6DCIF,建议你还是用5W30或0W30，20黏度太低，抗剪切肯定差，易造成发动机磨损！20黏度只是油耗低而已，难道你没有发现用20机油急加速高转有嘶吼声？,动力,0,
yrvYi2cFBMVsNmLS,全时四驱的当然需要4个都绑上了，两驱的话只帮两个就可以，当然最好都绑，记得关了ESp,操控,0,
ArMzLwWKO7uyPVgo,选森之前，昂克威还真进了备选项，喜欢主驾驶的包裹性设计，不过家里领导觉得有些商务，而且1.5T据说动力不太行，最后作罢，不过很庆幸选了森,空间,1,喜欢
ArMzLwWKO7uyPVgo,选森之前，昂克威还真进了备选项，喜欢主驾驶的包裹性设计，不过家里领导觉得有些商务，而且1.5T据说动力不太行，最后作罢，不过很庆幸选了森,动力,-1,不太行
ENcvKoaWgYAtJSTj,请问下XT市区油耗和高速各是多少我近期也想买一辆,油耗,0,
QxRq9UzeBlmhSXbA,XT获得过2013年全球十佳发动机，若不考虑价格差异，必须上2.0T的。,动力,0,
QxRq9UzeBlmhSXbA,XT获得过2013年全球十佳发动机，若不考虑价格差异，必须上2.0T的。,价格,0,
20el1LANQKRd83sX,非常神奇的是，真的搜不到，无论是搜酷威导航，还是搜航辉，无论是搜店铺，还是搜宝贝，都没有。只有一个航达辉。淘宝的流量是定向分类的，每个人搜索显示的结果都不一样你还是直接给地址吧,配置,0,
4K3prqaLn1t7E89S,逐渐坚定我换导航的决心了,配置,0,
D5wnkydOIs204lGq,有个800元的发动机护理套餐，包括油箱。另外清理下节气门。,动力,0,
vRsqI6yzdLkHQVA4,也就是说动力保留2.0和2.5？,动力,0,
yQwLlDRh0fY2UsdH,内饰配置方面怎样手刹后排出风口棒棒糖钥匙这些怎么样了,空间,0,
yQwLlDRh0fY2UsdH,内饰配置方面怎样手刹后排出风口棒棒糖钥匙这些怎么样了,配置,0,
yQwLlDRh0fY2UsdH,内饰配置方面怎样手刹后排出风口棒棒糖钥匙这些怎么样了,内饰,0,
faoNJE47zLtnRWpI,其实还是三代好看这一代前脸怎么感觉像以前的翼虎.,外观,-1,
P41Uzyq2MCew9F0Z,动力侠的算是价位比较高的了,动力,0,
oKJXzaHAUFqmw0kp,单从外观角度来说，还好我买的18款……新款如果真是这样，外观设计确实更符合主流suv设计，但是同时也失去了正面看窄、高的越野车外观共性，个人观点勿喷,外观,0,
JyukS3hvmHMWdYps,我现在就用手机，车载导航基本不用。,配置,0,
TLG5Ma9zuHC7nkWx,有啊。油门一点就窜，刹车轻踩没用，这是我刚提车时的感觉。不过后来适应了就好了。,安全性,0,
Tw8Hl0P7OisBc6gm,前脸还可以，更显年轻了，车尾灯变丑了，满大街这个尾灯造型，太平庸了,外观,-1,平庸
N7iC40rf58JGwOLy,刚买的时候发现抖动，也有好多车主反映，毕竟原来都是立式发动机，其实这发动机的热车怠速噪音很小，有时加油站忘了熄火，加油工竟听不出来。,舒适性,0,
N7iC40rf58JGwOLy,刚买的时候发现抖动，也有好多车主反映，毕竟原来都是立式发动机，其实这发动机的热车怠速噪音很小，有时加油站忘了熄火，加油工竟听不出来。,动力,1,噪音很小
niu17xMXkacLAQp6,楼主好执着，终于入手xt。我开了半年多感觉动力还是差点，40万以内买suv动力也就这意思了。,动力,0,
aK2XzWwj5F4CZpdu,新一代鹰眼2.0的会不会有，还有后排出风口,空间,0,
XIcY19s0jLebJ2Pp,确实可以从中控看，挺好用的,配置,0,
Es9kw87PAFcgeXGI,车身刚性应该是提高了，现款的森总感觉薄薄的，开关门没有德系车的厚重感,外观,-1,
0zPWx9mY1ECLvcRB,加个尾排，会对车性能有影响？？,操控,0,
0zPWx9mY1ECLvcRB,加个尾排，会对车性能有影响？？,动力,0,
pa79b2eXf1KhzwSM,你测过百公里加速时间吗。我反复测s#模式，最好一次7.6秒，一般都是在8秒左右。,动力,0,
Aua9CTvbctesY6EZ,是否有保留2.0L发动机？,动力,0,
bMjxECNgJYhOfv7c,换回原厂cd用手机导航,配置,0,
pOxfyTYXVcokwDuF,性能车就不能谈上，2.5后劲不是很好,操控,0,
pOxfyTYXVcokwDuF,性能车就不能谈上，2.5后劲不是很好,动力,0,
nUBiaIY2emPuhdvX,这个挺好的啊，我把导航换了，换成了这个,配置,0,
KMUrYtphjnigfXm4,22万了，上车必开空调，至今没坏过,舒适性,0,
bMl2wdzhFRLXNS38,森林人其实不软！我要为森林人刹车正名。森林人刹车是先软后硬习惯了你就会喜欢上这种不累脚的调教！,安全性,1,
5aluHjszwXmYfn96,看前脸，接近角比现在貌似又小了。,外观,0,
B75TgGfWiZlxDhVE,可以，但是现在的导航都不能区别区间测速。,配置,0,
jLCgqzToPylZ53WV,也许是你的刹车盘有点问题，比如说有划痕啊，有水啊什么的，它就很容易有那种声音,安全性,0,
1IO3mUVfo95cMQGe,嘿嘿，内饰图你没有吧。我是从3月庞大经销商大会的PPT里弄出来的,内饰,0,
Ovjn9sFYK3efVzB6,内饰和新XV差不多，没有什么疑问,内饰,0,
7JiduPlsfnUkz9Y8,还有就是新车车门和后备箱胶条硬，颠簸时摩擦会嘎吱响，喷些清洁蜡水就不响了，用到现在不喷蜡也不响了，用手按压胶条感觉也没新车那么硬,空间,0,
pV0dY5ghOsQ14S29,都是矛盾，现款好看，但内饰很low，换代新款不太好看，但内饰和科技安全方面肯定又会大提升。真希望是现款的霸气外观配合换代款的内饰及科技安全，这就完美许多了，呵呵,外观,0,
pV0dY5ghOsQ14S29,都是矛盾，现款好看，但内饰很low，换代新款不太好看，但内饰和科技安全方面肯定又会大提升。真希望是现款的霸气外观配合换代款的内饰及科技安全，这就完美许多了，呵呵,内饰,0,
sYp98MFOXaLmjUPw,自动变速箱中还有个CVT...,动力,0,
l7uI5jTwvNS9nkaV,我是6W多自己找地换的，前后差速器油共3升，一定要GL-5的，属于重载的全合成，变速箱油一定要CVT专用的，基本9-10升，一半用来涮一遍跑一圈放了，比循环机要省一点！,动力,0,
SFNwUXiIjp8nBaOR,我也觉得...一般变速箱温度起来，跑120才2100-2200的样子,动力,0,
hHEmMwaSLx0pfVgt,收音机，可以切换到usb或者AV，或静音，导航的话，如果是四维图新，点击屏幕，出现菜单，点功能，右下角选择项，退出导航，,配置,0,
BofZ940guhP6mwYM,我也有的，不是事儿。还有就是红灯起步时，你慢慢松刹车，会有吱吱的声音，大家有吗？属于正常吗？是动力和四区的缘故吗？,动力,0,
BofZ940guhP6mwYM,我也有的，不是事儿。还有就是红灯起步时，你慢慢松刹车，会有吱吱的声音，大家有吗？属于正常吗？是动力和四区的缘故吗？,安全性,0,
M5yrcFwNeQ3JaGqs,2.0T多好的发动机啊。。何必弄个1.8T。。,动力,0,
kG71fEYJ0OvdRxSN,94000公里换刹车片厉害,安全性,0,
UgTDQid4YKfyB8N7,面板和主机一体的，带空调出风口面板的。配置就是2G内存，32G闪存。闪存是16G装系统加16G板载。凑合用着还成。没法拍照了，我的爱森被我老板开走了，昨晚他的大切在路上趴窝了。囧。,配置,0,
UgTDQid4YKfyB8N7,面板和主机一体的，带空调出风口面板的。配置就是2G内存，32G闪存。闪存是16G装系统加16G板载。凑合用着还成。没法拍照了，我的爱森被我老板开走了，昨晚他的大切在路上趴窝了。囧。,舒适性,0,
xQZRcqyWmSsNOUl0,今天去一个小店换了前刹车片。顺便换了机油。,安全性,0,
lAgk3UVviojMpK9e,我以前也发过几篇这种贴，我今年只想等换代森林人和cx-8六座出来比较后就买，一家人多小孩又大了真心接受不了cx5后排，望参考,空间,0,
ZqrDj4ipsY6KScW7,个人不太接受傲虎的外观,外观,0,
wf9IAaQ3TgZDMWk2,这个是底盘的胶套，减震器胶垫，平衡杆胶垫有松旷老化的，所以在走颠簸路的时候发出吱吱吱的响声，把胶套更换了就可以了，,操控,0,
TysXgJrIz1paw3d7,底盘松散只要换一套底盘胶套就可以了，方向盘抖动要是怠速抖动就是积碳严重，清洗节气门和进气道还有三元催化，如果是高速踩刹车抖，就把刹车盘光盘就行了。,操控,0,
TysXgJrIz1paw3d7,底盘松散只要换一套底盘胶套就可以了，方向盘抖动要是怠速抖动就是积碳严重，清洗节气门和进气道还有三元催化，如果是高速踩刹车抖，就把刹车盘光盘就行了。,安全性,0,
xrFHKC7b4iJDQlN8,刹车盘有什么推荐？佐佐木？,安全性,0,
NGW3DpCsq5Y7bKmU,刹车盘没有特别关注过，只要是正品都不会有多大差别吧,安全性,0,
McPvXlCtkH6sjzRY,淘宝有，我的意思是斯巴鲁不生产自行车，他其实就是闪电牌的，只是喷的斯巴鲁的标。你查看他的性能和价格，可以在淘宝找找这个品牌的公路赛车,操控,0,
McPvXlCtkH6sjzRY,淘宝有，我的意思是斯巴鲁不生产自行车，他其实就是闪电牌的，只是喷的斯巴鲁的标。你查看他的性能和价格，可以在淘宝找找这个品牌的公路赛车,动力,0,
McPvXlCtkH6sjzRY,淘宝有，我的意思是斯巴鲁不生产自行车，他其实就是闪电牌的，只是喷的斯巴鲁的标。你查看他的性能和价格，可以在淘宝找找这个品牌的公路赛车,价格,0,
E6aiZlKe9tGMYbQo,8.5万了。。冷车发动机轰鸣不走到道，，车热了就好了什么情况,动力,0,
N58RDASEFVUtGOuf,我买完跟后备箱放俩月了，一直就没想起来装,空间,0,
X3z2cACvFNBKMgR8,机油变速箱油差速器油刹车油防冻液空调冷媒在4s加起来4000吧。自己换就不一定了，牛奶油一升200，piaa滤芯。换机油就一千二了。,舒适性,0,
X3z2cACvFNBKMgR8,机油变速箱油差速器油刹车油防冻液空调冷媒在4s加起来4000吧。自己换就不一定了，牛奶油一升200，piaa滤芯。换机油就一千二了。,动力,0,
X3z2cACvFNBKMgR8,机油变速箱油差速器油刹车油防冻液空调冷媒在4s加起来4000吧。自己换就不一定了，牛奶油一升200，piaa滤芯。换机油就一千二了。,安全性,0,
mpPWgC4kZSKDaE5w,我的同款现在6万公里多点，今年检车尾气不合格。,外观,0,
wXd34kuFG105vPiE,讲真，外观时尚就选马自达吧，森林人适合我等老汉钓鱼户外用,外观,0,
OBeXA374FUpmbklt,本来想推荐5-30的，一看楼主都用0-40都烧，看来要修发动机,动力,0,
cw9P1lFsmt8I2OpD,在南方0W30长期可以用！如果经常发动机高转速的话必须0W30！对发动机好点，但油耗高一点点。,油耗,-1,
cw9P1lFsmt8I2OpD,在南方0W30长期可以用！如果经常发动机高转速的话必须0W30！对发动机好点，但油耗高一点点。,动力,0,
RNGV18DzcCUgqy6o,自己换的话，机油400多，刹车油60多，变速箱油重力换8升，循环12升（这个要1000多），差速器油前后200多吧（4升），就这么多了不到2000元。去4S就翻倍吧,动力,0,
RNGV18DzcCUgqy6o,自己换的话，机油400多，刹车油60多，变速箱油重力换8升，循环12升（这个要1000多），差速器油前后200多吧（4升），就这么多了不到2000元。去4S就翻倍吧,安全性,0,
7R2SEHlyri8DePGI,森林人越野强于傲虎，无他轴距短；傲虎内饰舒适性好于森林人我选森林人因为全景天窗,舒适性,1,好
7R2SEHlyri8DePGI,森林人越野强于傲虎，无他轴距短；傲虎内饰舒适性好于森林人我选森林人因为全景天窗,内饰,1,
1HuUZnqpNGYhrO4F,在想，装了这个，下马路牙子咔嗒一下，虽然是软性材料，但是咔嗒一下，心理有负担再一个，跑告诉的时候，那个地方的风噪和胎噪反射，不是更大么，,舒适性,0,
1HuUZnqpNGYhrO4F,在想，装了这个，下马路牙子咔嗒一下，虽然是软性材料，但是咔嗒一下，心理有负担再一个，跑告诉的时候，那个地方的风噪和胎噪反射，不是更大么，,内饰,0,
TAFId4oxinNUQKCu,2.0T落地价格太贵了,价格,-1,价格太贵
JsVXERQz8c9WqFal,习惯就行了，森林人就是买发动机加四驱，其他的都是辣鸡不要要求太高。先摸摸纸壳内饰板，再看看一块布挡着的方向盘最后再从油门刹车踏板往上瞅瞅你就懂我说的啥。,操控,-1,
JsVXERQz8c9WqFal,习惯就行了，森林人就是买发动机加四驱，其他的都是辣鸡不要要求太高。先摸摸纸壳内饰板，再看看一块布挡着的方向盘最后再从油门刹车踏板往上瞅瞅你就懂我说的啥。,动力,-1,
JsVXERQz8c9WqFal,习惯就行了，森林人就是买发动机加四驱，其他的都是辣鸡不要要求太高。先摸摸纸壳内饰板，再看看一块布挡着的方向盘最后再从油门刹车踏板往上瞅瞅你就懂我说的啥。,安全性,-1,
JsVXERQz8c9WqFal,习惯就行了，森林人就是买发动机加四驱，其他的都是辣鸡不要要求太高。先摸摸纸壳内饰板，再看看一块布挡着的方向盘最后再从油门刹车踏板往上瞅瞅你就懂我说的啥。,内饰,-1,
4JAMrzbxKVOawtoi,二台都开过，感觉澳虎要舒适不少，而且也是四驱，底盘也不底，空间还大。,操控,1,
4JAMrzbxKVOawtoi,二台都开过，感觉澳虎要舒适不少，而且也是四驱，底盘也不底，空间还大。,空间,1,
4JAMrzbxKVOawtoi,二台都开过，感觉澳虎要舒适不少，而且也是四驱，底盘也不底，空间还大。,舒适性,1,
Kg1auoNU3Jrsk2bP,2.5起步绝对快，但后段就没劲儿了，动力算够用。要单纯追求动力还是上T好。,动力,0,
O0DRWxZy3kTQrSH8,打算入手一台07款2.5t，但是发动机说是有轻微异响，才跑了8万多一点…车况很好…不知道能不能入手，求解…,动力,0,
1CoKe9PJXBca4EIH,当时不懂，看网上车评评价不错，其实这个车性价比很低，配置简陋，到处异响，卖个15W差不多，高了不值,配置,-1,配置简陋
0YBLcC16TMQoSg7N,性价比及其低下，整车品控一般，主要是FB发动机烧机油风险很大，非常大！,动力,-1,风险很大
I0KEV5sBCeUXcpPx,我也是，已买了底盘大修包。,操控,0,
6h0lxmfKQAYiVzvq,原来有个帖子讲在后视镜根部贴胶带减少风噪的办法，一直想试试只是没找到合适的材料。但是后来在高速上我想体验下后视镜风噪到底有多大将后视镜折叠起来试了几次发现风噪基本没有区别。,舒适性,0,
6h0lxmfKQAYiVzvq,原来有个帖子讲在后视镜根部贴胶带减少风噪的办法，一直想试试只是没找到合适的材料。但是后来在高速上我想体验下后视镜风噪到底有多大将后视镜折叠起来试了几次发现风噪基本没有区别。,内饰,0,
aR5nOgNsjXq9uEZw,个人看法应该还是那个三角窗玻璃的密封问题。而且我的感受森林人的风噪比Rav4、Crv之类还明显略好一点，比国内合资15万以上的桥车都要差。,舒适性,0,
LB05vE1JrZzAGymV,就是那里导致的，这个细节充分暴露了斯巴鲁的农用车本质……别的牌子的车后视镜与车门结合部位就不会漏风……好在我花十块钱打了一圈密封胶搞定了,内饰,0,
P4mtudpG9HfzXQvk,好多车都这样，那是刹车盘和片子要分开不分开的那声,安全性,0,
ETzwroAinP6Wqsxg,CVT变速箱无需更换，如果是其他的应该按照说明书操作。,动力,0,
IQFqVB4zoWrvl6g2,坐标上海2017款的森林人肯定有。价格也比18款低2万。但是只有1-2家有库存了。我浦东的看过就没有。但是老款灯不行。。还有小配置差一点。,价格,0,
IQFqVB4zoWrvl6g2,坐标上海2017款的森林人肯定有。价格也比18款低2万。但是只有1-2家有库存了。我浦东的看过就没有。但是老款灯不行。。还有小配置差一点。,配置,-1,差一点
ndsW32fLe1lBhuzS,昨天特地拿它又确定了下，不到2500转，120km每小时。你这个还是去查查吧，变速箱油什么的都换了吗,动力,0,
twGDzEFflJYC1WLo,没有不烧机油的发动机，主要看怎么操作，把机油消耗降低到合理的水平,动力,0,
UeAHEj5LfmDhId2R,2.0的丐版和其它款的变速箱一样吗，我看2.0丐版是CVT，其他都是CVT标明模拟六档，一样吗，2.0和2.5哪个容易烧机油。,动力,0,
w3L8s0rjNvkldVux,2.0丐版的变速箱是不是和其他的不一样,动力,0,
dFbLapmsGQInzYvh,单论驾驶森能给你的早就超15w了，要拼内饰电子斯巴鲁没戏！现在bba也不贵卖了换一台选斯巴鲁等于走向不归路,内饰,-1,没戏
lhVYEZkwjBLusKvb,没大梁，震动过了底盘，就全靠车厢，就这样了。,操控,-1,
eWg60J4kiyh7AQcN,楼主厉害，用刹车少，那油耗得比较低吧。。。。俺六万多就换了，在4s店换的号称高端的刹车片，900多，被黑了，好像是碳啥的，结果几千公里下来一直有叽叽响，踩前半段的时候响，后半段反而不响了，恼人,安全性,-1,恼人
eWg60J4kiyh7AQcN,楼主厉害，用刹车少，那油耗得比较低吧。。。。俺六万多就换了，在4s店换的号称高端的刹车片，900多，被黑了，好像是碳啥的，结果几千公里下来一直有叽叽响，踩前半段的时候响，后半段反而不响了，恼人,油耗,0,
kuJUq0BelgHrQoX1,这俩半斤八两！国产的QX50一般，论开森2.5舒适50动力没啥区别！还得37才是硬道理哈哈,动力,0,
JAMPWgYTr1pezq3R,对比一下看看配置，然后试驾一下，适合自己的需求和审美就行,配置,0,
3FTuN0R2qzpt1rhC,还行吧，油耗和路况关系也很大哦，我路况好，基本在7点几个，我也是看帖子有车友用金麒麟的片，说效果不错，我就尝试了下，感觉是可以的，性价比很高，耐用度还不确定。,油耗,0,
Xga3k5c8HA0ULGOF,放尼玛的屁h5就是前置前驱车而且tmd还是横置发动机,动力,0,
fk7SCqhOuzNZ5J3t,一切都正常，导航速度不对那个都有，和手机性能有关，不用担心，回去检查底盘胶套，注意观察是否烧机油，渗油，然后看看正时皮带是否老化,操控,0,
fk7SCqhOuzNZ5J3t,一切都正常，导航速度不对那个都有，和手机性能有关，不用担心，回去检查底盘胶套，注意观察是否烧机油，渗油，然后看看正时皮带是否老化,动力,0,
fk7SCqhOuzNZ5J3t,一切都正常，导航速度不对那个都有，和手机性能有关，不用担心，回去检查底盘胶套，注意观察是否烧机油，渗油，然后看看正时皮带是否老化,配置,0,
2hri1MoaJBS4OxuL,只要不低于92的就可以，如果车辆的发动机压缩比高的话，可以尝试下95的，充分发挥95的动力，不然的话，就一直92的吧，免得浪费金钱又浪费95的动力。,动力,0,
qJI1C6YghGDuiKyW,算了，还真找不到这车型的导航，大小有牌子的都没有，剩下无牌子的又不敢下手。有的还不认得，说你这是江淮的什么车，搞笑。,配置,0,
DRZV0pjkweJgaTl8,一直92动力燃烧抖动都非常好，新车第四次加的95，没感觉差别，反而怠速时要比92都懂幅度稍大。,动力,0,
hV7PT50BkotXM2qw,安卓导航音质很差，不如原车的，建议换建武主机，要用安卓导航的话再加个安卓导航盒子连到主机，这样音质是建武的，导航是安卓的，是目前最佳方案。,配置,-1,很差
Ja8QgiUj3v40Ibex,我也有这想法呢……你是前后都换么？前400后200？是不是排气声率为会大点，油耗有啥影响没？,油耗,0,
5Cspfyc6iNYVrza1,想问一下你装的是什么版本，听说油耗显示的是加仑，温度是华氏度，对吗？,油耗,0,
MYJ2pg7KOlU6dXG9,这时间段还是二环是真够低的，是2.5排量的吗？综合油耗应该也不高吧？我基本也是二环跑的多，总里程2万公里，综合油耗是9，相当棒的数据了。还有，哥们儿那照片害的我歪着脖子看了半天,油耗,1,相当棒
wd62guG7rDBI0PqU,修车半天了，老远都能听到，师傅说可能不是前面轮胎附近，可能在车身下面。还没找出原因，,外观,0,
YrAomNG1xPv2Z5wC,1、建议加装最好别动线路，这车容易异响2、磨合期说明书说不超四千，反正我没有超三千3、2.0和2.5在2018款外观内饰区别不大，只有顶配可以选棕色内饰，还有ES版的眼睛,外观,0,
YrAomNG1xPv2Z5wC,1、建议加装最好别动线路，这车容易异响2、磨合期说明书说不超四千，反正我没有超三千3、2.0和2.5在2018款外观内饰区别不大，只有顶配可以选棕色内饰，还有ES版的眼睛,内饰,0,
1OWSu8dwb2ksUqcx,两万一千转？？？前顶是平衡杆吗？俗称顶吧？这个对油耗有影响吗？,油耗,0,
NISm5PXxMCksE9Bc,隔音做了增加车重增加油耗…,油耗,-1,
Ydso49JuOGCpMyzT,你要我可以卖给你，因为我考虑想改座椅通风。,内饰,0,
